Grapheme	IPA	EXAMPLES	LANGUAGES	FREQUENCY	CODEPOINTS
àh$	àh	àyàh, tiàh	MALAY, SEMANG, TALAINGSPOKEN, SAKAI, HEMIAO, KATURR, TAUNGYO	17	U+00e0 U+0068 U+0024
lw	lw	halwāhiā, θi-pōṅ lwe	TAUNGTHU, SGALITERARY, KARENBYU, DHANNI, POTHWARI, CHINBON, WAZIRI	17	U+006c U+0077
lᵘ$	lᵘ	mogᵃ gurramᵘ-lᵘ, āvᵘ-lᵘ	TELUGU, KASHTAWARI, POGULI, SINDHIVICHOLI, KASHMIRI	17	U+006c U+1d58 U+0024
ii	iː	nā-mo ni-to-mai-inūi, kai-in ka-vē	GADABA, MAN, AIMOL, SOPVOMA, EASTERNPAHARIORKHASKURA, PADIPAHRIORPAHI, KOREAN, WAXI, PURUM, JUANG, HIROILAMGANG	17	U+0069 U+0069
eᵏ$	eᵏ	àdeᵏ, peᵏ	KHAMI, MALAY, KADU, SIAMESESPOKEN, KANAURI, PALAUNG, SHOORKHYANG	17	U+0065 U+1d4f U+0024
ṛᵃ	ṛᵃ	laṛᵃkā, k’arāb laṛᵃkī	WESTERNHINDIHINDOSTANI, MAGAHI, PASHTOOFPESHAWAR, PASHAIEASTERN, BUNDELI, BANGARU, GHISADI, WAZIRI, CHHATTISGARHI	17	U+1e5b U+1d43
ts$	ts	unts, verafts-	BASHGALI, SHIYNI, TELUGU, WASIVERIORVERON, ORMURI, SARIKOLI, KONKANI, MANCHATIORPATNI, BASQUE, MARATHIDESHI, BURUSHASKI, NAGPURI	17	U+0074 U+0073 U+0024
^e$	e	e, e-	AINU, KATURR, HLOTA, MOPWABILICHI, YINRIANG, AKA, MANCHATIORPATNI, DANAO, SINGHALESE, JAPANESE, SZIORATSI	17	U+005e U+0065 U+0024
^āss	āss	āssē t’ē, āssārā	MANDEALI, KULUI	17	U+005e U+0101 U+0073 U+0073
^R	R	Rabb, Rām	POWADHI, KUIKANDHIORKHOND, RAJASTHANIMARWARI, BHOJPURINORTHERN, THALI, PUNCHHI, VERNACULARHINDOSTANI, BANGARU, MEWATI, PANJABIWRITTEN, TINAULI, POTHWARI, PANJABISPOKEN, RONGORLEPCHA, KEZAMA, LAHNDAOFSHAHPUR	17	U+005e U+0052
^ṣ̌	ṣ̌	ṣ̌tūrj, ṣ̌a saṛī	PASHTOOFKANDAHAR, SHINAGILGITI, ORMURI, SARIKOLI, WAZIRI, ARABIC, WAXI	16	U+005e U+1e63 U+030c
^ā̃$	ã̄	ā̃	RAIORJIMDAR, KASHTAWARI, KHETRANI, SHODOCHI, EASTERNBENGALI, PANGWALI, SUNWAR, NICOBARESE, PADARI, LARI, BALOCHIMAKRANI, BHADRAWAHI, DODASIRAJI, KIUTHALI, RAMBANI, CHILASI	16	U+005e U+0101 U+0303 U+0024
ǎs	ǎs	bābǎs-k, grǎst	GYPSYEUROPEAN, GYPSYSYRIAN	16	U+01ce U+0073
pᵃ	pᵃ	bāpᵃnō, bāpᵃnē	KATHIYAWADI, KHAMI, NIMADI, TAUNGTHA, CHAROTARI, THAYETMYOCHIN, LAI, NAGPURIA	16	U+0070 U+1d43
ḷᵘ$	ḷᵘ	ākaḷᵘ, magaḷᵘ	KANARESE, TELUGU	16	U+1e37 U+1d58 U+0024
^bw	bw	bwāṅ-ṅā, bwāk-tā-ni	BAHING, SGASPOKEN, DARANG, BRAJBHAKHA	16	U+005e U+0062 U+0077
iᵏ$	iᵏ	yaiᵏ, piᵏ	LOHORONG, TALAINGSPOKEN, THAYETMYOCHIN, MALAY, DANU, INTHA, BURMESESPOKEN, TAVOYAN, PHUNSAMONG, CANTONESE	16	U+0069 U+1d4f U+0024
zᵃ$	zᵃ	˨˦ nī ˨ man ˦˨ szᵃ, ˦ t’ā ˦˨ szᵃ	MANDARIN, ORMURI, WAZIRI	16	U+007a U+1d43 U+0024
ṁ	<?>	kiṁtu, tum’ēhiṁ māriō	PRAKRIT, SANSKRIT, SIAMESEWRITTEN, BURMESEWRITTEN	16	U+1e41
ōh$	ōh	lōh, gōh	KOHISTANIGARWI, KALASHA, EASTERNHINDIAWADHI, MEWATI, SIRMAURI, PADARI, BASHGALI, BAGHELI, BIHARIMAITHILI, MALVI, MAIYA, PERSIAN	15	U+014d U+0068 U+0024
^às	às	àsaiḥ, às neàk cheà	KHMER, CHAM, AKO, ZAVEIN, AKAKA, SALON	15	U+005e U+00e0 U+0073
āā	āā	mā-āṅ, bā-ān	SANGPANG, RAIORJIMDAR, GADABA, EASTERNBENGALIOFCACHAR, BODOORBARA, WALING, KHAMBU, RUNGCHHENBUNG, AHOM, HALLAM, EASTERNBENGALIOFCHITTAGONG	15	U+0101 U+0101
^nᵃ	nᵃ	nᵃ-veᵗ li-kōm, nᵃ-kaˡ li-kōm	LAI, DANU, THAYETMYOCHIN	15	U+005e U+006e U+1d43
ēw$	ēw	ḍēw-, Dēw	PHADANG, WAR, RAJASTHANIMARWARI, SHODOCHI, PAHLAVI, SIRMAURI, KHANDESI, GHISADI, ISHKASHMIZEBAKI, KIUTHALI, LABHANIOFBERAR	15	U+0113 U+0077 U+0024
^ạ̄	ạ̄	ạ̄n mȫꭓ, ạ̄n lạr	PALAUNG, KHERWARISANTHALI, MUNDARI	15	U+005e U+1ea1 U+0304
ǟ	<?>	hoňda gǟṇiyek, hoňda gǟṇu	LADAKHIOFSPITI, SINGHALESE, BHOTIATIBETANSPOKEN	15	U+01df
rᵉ$	rᵉ	ḍḍūrᵉ, bbārᵉ	KANARESE, LARI, SINDHIVICHOLI	15	U+0072 U+1d49 U+0024
àᵗ$	àᵗ	kᵃyàᵗ, myàṅ sàᵗ	TAUNGTHA, MARAN, PALAUNG, ARAKANESE, AKAKA, CHINGPAORKACHIN, KARENNI, KADU, KATURR, LAHU	15	U+00e0 U+1d57 U+0024
mᵘ	mᵘ	mogᵃ gurramᵘ-lᵘ, ˨ mᵘ ˦˨ ha ˨˦ še	TELUGU, LOLONI	15	U+006d U+1d58
^ks	ks	ksew, ksià	KHASISTANDARD, WAR, KANAUJI	15	U+005e U+006b U+0073
^ōh$	ōh	ōh	CHIBHALI, PUNCHHI, POWADHI, TINAULI, GADI, KOHISTANIGARWI, PANGWALI, HRANGKHOL, PADARI, BHADRAWAHI	15	U+005e U+014d U+0068 U+0024
^j̄	j̄	j̄e-mei, j̄e hnu	THAYETMYOCHIN	15	U+005e U+006a U+0304
ụ	ụ	˨ àm ˦˨ saụ ˦ kwai, ˦ naụ ˦˨ wā	SHAN, SIAMESESPOKEN, SIAMESEWRITTEN	14	U+1ee5
^dw	dw	dwa, dwi	CENTRALPAHARIKUMAUNI, PASHTOOFPESHAWAR, GARHWALI, WAZIRI, PASHTOOFKANDAHAR, CHAURASYA, THAYETMYOCHIN, BRAJBHAKHA, MISHMIDIGARU	14	U+005e U+0064 U+0077
vh	vh	avhā̃-jō, tavhī̃ huau	SINDHIVICHOLI, PERSIAN, KOLAMI	14	U+0076 U+0068
yy	yː	payyu, ch’ēl bayyar	BANGARU, KODAGU, TELUGU, GADABA, MALTOORMALER, DEURICHUTIYA, MALAYALAM, BAGHATI, PRAKRIT	14	U+0079 U+0079
yⁱ$	yⁱ	nāyⁱ, nī āyⁱ	MALAYALAM, KANARESE	14	U+0079 U+2071 U+0024
^šw	šw	šwi, šwe	CHINBON, BHOTIATIBETANWRITTEN, ARAKANESE, LAI, TAVOYAN, TAUNGTHA, TAUNGYO	14	U+005e U+0161 U+0077
^ā̃h	ā̃h	ā̃hā̃ janant’, ā̃hiyā	EASTERNBENGALI, BALOCHIMAKRANI, BRAJBHAKHA	14	U+005e U+0101 U+0303 U+0068
rᵃs	rᵃs	kirᵃsān, wō mārᵃsē	KHARAWA, NIMADI, KHANDESI, RAJASTHANIMARWARI, MALVI, NAGPURI	14	U+0072 U+1d43 U+0073
å̃$	ḁ̃	nå̃, àyå̃	PUNCHHI, AKAKA, MULTANI, THALI, DEURICHUTIYA, KHERWARISANTHALI, TINAULIOFSALTRANGE, LAHNDAOFSHAHPUR	13	U+00e5 U+0303 U+0024
^à$	à	à, à-	BWE, SON, BRAEO, KHAMUK, MANOE, KARENBYU, DANAO, KARENNI, TALAINGSPOKEN, MOPWADERMUHA, DARANG, WEWAW	13	U+005e U+00e0 U+0024
āw$	āw	gāw, ši-kāw	WESTERNPAHARIJAUNSARI, SIRMAURI, AHOM, KHASISTANDARD, TABLENG, MEWATI, LABHANIOFBERAR	13	U+0101 U+0077 U+0024
ḍᵘ	ḍᵘ	āḍᵘ-gaḷ, iraṇḍᵘ tagappaṉār-gaḷ	TELUGU, TAMIL, MALAYALAM, KANARESE	13	U+1e0d U+1d58
üw	üw	abā düwa kū, mīzo düwa	MOSHO	13	U+00fc U+0077
lᵃ$	lᵃ	illᵃ, zālᵃ	TELUGU, LARI, SINDHIVICHOLI, KANARESE, PASHAIEASTERN, MANCHATIORPATNI, MALAYALAM	13	U+006c U+1d43 U+0024
vᵘ$	vᵘ	āvᵘ, nīvᵘ pōtāvᵘ	TELUGU, KANARESE, KASHMIRI	13	U+0076 U+1d58 U+0024
ḷḷ	ḷḷ	boḷḷi, yaḷḷi chigari	KANARESE, MALAYALAM, KORAVA, TULU, TAMIL	13	U+1e37 U+1e37
ṛᵘ$	ṛᵘ	g’ōṛᵘ, šuṛᵘ	KASHTAWARI, POGULI, RAMBANI, SINDHIVICHOLI, KANARESE	13	U+1e5b U+1d58 U+0024
^θᵃ	θᵃ	θᵃmi, θᵃmi do	DANU, ARAKANESE, MEGYAO, TAVOYAN, PHUNSAMONG, TAUNGYO	13	U+005e U+03b8 U+1d43
às$	às	màs, meàs	MONGOLIAN, SEMANG, MALAY, SAKAI, SALON, KHMER, SHINAGILGITI	13	U+00e0 U+0073 U+0024
dw	dw	wei au dwà tà, tā-dwī	TAUNGTHU, TAVOYAN, VAYUORHAYU, KWOIRENG, MARING	13	U+0064 U+0077
^āw	āw	āwend-e dēd-en, āwenda	ISHKASHMIZEBAKI, TABLENG, PASHAIWESTERN	13	U+005e U+0101 U+0077
åhh$	åhh	pe  låhh, ǔn hwaiᵏ låhh	KATURR	13	U+00e5 U+0068 U+0068 U+0024
^āw$	āw	āw-	RAJASTHANIMARWARI, GUJARATISTANDARD, EASTERNHINDIAWADHI, VERNACULARHINDOSTANI, KATHIYAWADI, KHARAWA, GHISADI, NIMADI, JAIPURI, BANAPHARI, BHILI, BHOJPURISOUTHERN, CHAROTARI	13	U+005e U+0101 U+0077 U+0024
āā$	āā	māā, pāā	PRAKRIT, PUNCHHI, KHAMBU, NACHHERENG, LIMBU, SINGPHO, THAYETMYOCHIN, KULUNG	12	U+0101 U+0101 U+0024
ee	eː	me-e sáᵗ, ta-màua-še-enkāna	NICOBARESE, TAUNGTHA, YAKHA, AINU, PADIPAHRIORPAHI, MONGOLIAN, BASQUE	12	U+0065 U+0065
nᵉ$	nᵉ	avanᵘ hoḍeyuttānᵉ, tagappaṉāriḍamirunᵉ	KANARESE, SINDHIVICHOLI, TAMIL, LARI	12	U+006e U+1d49 U+0024
ɣ́	ɣ́	yå-ḏẕå myi-ɣ́e nau ɣ́e, ᵃpå ɣ́e	MARU, LISHAOYAOYIN	12	U+0263 U+0301
^ᵃm	ᵃm	ᵃmi, ᵃme θā	THAYETMYOCHIN, TAVOYAN, NUNG, PHUNSAMONG, DANU, ARAKANESE	12	U+005e U+1d43 U+006d
^ᵃn	ᵃn	ᵃnà-mā, ᵃnā	TAVOYAN, PHUNSAMONG, DANU, MEGYAO, INTHA, NUNG	12	U+005e U+1d43 U+006e
^mᵃ	mᵃ	mᵃnö à, mᵃjå	CHINGPAORKACHIN, KHAMI, ARAKANESE, DANU, AKAKA, MAINGTHAORNGACHANG, LAHU	12	U+005e U+006d U+1d43
ǒᵏ	ǒᵏ	ñah tǒᵏ t’àᵏ ruṅ, p’eh tǒᵏ t’àᵏ ruṅ	TALAINGSPOKEN, DANU	12	U+01d2 U+1d4f
^ꭓ́	<?>	ꭓ́ēr, ꭓ́àṅ	PASHTOOFPESHAWAR, SARIKOLI, SHIYNI, MARU, WAXI, PHUNSAMONG	12	U+005e U+ab53 U+0301
īw	īw	brīw bà-b’ā, mīwōr	SHODOCHI, GONDI, KHASISTANDARD, ORMURI, EASTERNHINDIAWADHI, TURKI, WESTERNPAHARIJAUNSARI, HLOTA, WESTERNHINDIHINDOSTANI	12	U+012b U+0077
rw	rw	k’ētarwàḷā, gōrwi	GYPSYSYRIAN, YAWDWIN, EASTERNBENGALI, KHANDESI, KACHCHHI, YUDYA, DOGRI	12	U+0072 U+0077
^zᵃ	zᵃ	zᵃ waiyā̃, zᵃ żᵃm	WAZIRI, PASHTOOFPESHAWAR	12	U+005e U+007a U+1d43
ǎs$	ǎs	ǎmen jǎs, tumen isǎnǎs	GYPSYEUROPEAN	12	U+01ce U+0073 U+0024
īᵃ	īᵃ	= ṅwà ˨ nū ˦ tīᵃ ˧ lå, = nū ˦ tīᵃ ˧ lå	LISU	12	U+012b U+1d43
δ̤	δ̤	naḥnu δ̤āribūn, antum δ̤āribūn	ARABIC	12	U+03b4 U+0324
ṭs	ṭs	oh kuṭṭsan, āmrā piṭsilām	POTHWARI, EASTERNBENGALI	12	U+1e6d U+0073
ì	ì	po mü l^ì pà, kì pǒh	TALAINGSPOKEN, PWOMAULMEIN, WA, PWOBASSEIN, DANAO, BWE, WEWAW, MOPWADERMUHA, GHEKO, VIETNAMESE	11	U+00ec
nh	nh	nariyānhā, kenhi	KEZAMA, PERSIAN, MAGAHI, WA, PYENORPYIN, HINDKI, THUKUMI, BURMESEWRITTEN, SEMA	11	U+006e U+0068
ǖ	<?>	kạr-vǖ-ä, miǖṇ	PALAUNG, BHADRAWAHI, PADARI	11	U+01d6
dᵘ$	dᵘ	tagappaṉār-gaḷiḍatti lirindᵘ, t’odᵘ	KASHMIRI, TELUGU, SINDHIVICHOLI, KANARESE, TAMIL, MALAYALAM	11	U+0064 U+1d58 U+0024
kᵘ$	kᵘ	lōkᵘ, taṇḍrᵘ-la-kᵘ	TELUGU, TAMIL, RAMBANI, MALAYALAM, KANARESE	11	U+006b U+1d58 U+0024
rⁱ	rⁱ	taṇḍrⁱ-daggirⁱ-nuñchⁱ, nallᵃ istirⁱ-gaḷ	BRAEO, TELUGU, KANARESE, TAMIL	11	U+0072 U+2071
īh	īh	bīhī, vīha	PUNCHHI, KIUTHALI, DHIMAL, LARI, BHADRAWAHI, SINDHIVICHOLI, TODA, KULUI, GADI	11	U+012b U+0068
^pw	pw	pwe, pwā	SGASPOKEN, LASHIORLECHI, BAHING, CHINBOK, ANGKU, MOENGLWE, CHAKMA, SZIORATSI	11	U+005e U+0070 U+0077
^ās$	ās	ās, ās-	PASHTOOFPESHAWAR, PASHTOOFKANDAHAR, NACHHERENG, ORIYA, PANGWALI, EASTERNBENGALI, BENGALIWRITTEN, KURUXORORAO, BALOCHIMAKRANI	11	U+005e U+0101 U+0073 U+0024
uᵏ	uᵏ	ūm-mā  huᵏ-wā, muᵏ rà-sou	KATURR, CANTONESE, BURMESESPOKEN, LOHORONG	11	U+0075 U+1d4f
àss	àss	màssow, màssi šinràṅ	KHASISTANDARD, WAR, SAKUPA	11	U+00e0 U+0073 U+0073
ṇᵃ	ṇᵃ	tāhṇᵃ kǒṭnal, miṅaṇᵃ k’ui-re	PADARI, MANCHATIORPATNI, JAIPURI	11	U+1e47 U+1d43
^δ̤	δ̤	δ̤araba, δ̤arabtum	ARABIC	11	U+005e U+03b4 U+0324
ň	ň	naň tā-me-ṅē, hoňda gǟṇiyek	SINGHALESE, MIAOTSUHMONG, NAMSANGIA, CHINGPAORKACHIN, KWOIRENG, OLDMEITHEI	11	U+0148
q$	q	ērkāk sāūq, qūlāq	TURKI, MALTOORMALER, WASIVERIORVERON, KHOWARORCHITRALI	11	U+0071 U+0024
aᵏ	aᵏ	chyaᵏ-chī, menaᵏ-pä-ā	MUNDARI, KHERWARISANTHALI, LAMBICHHONG, LOHORONG	11	U+0061 U+1d4f
^S	<?>	Sāhab, Sū-rà-rel	KASHTAWARI, MARAM, KAGATE, SAVARA, KARENNI, MUNDARI, ANDRO, KHOIRAO, DARANG, MIJU, YINRIANG	11	U+005e U+0053
ȫ$	ȫ	-hȫ, àmȫ	CHAM, PALAUNG	10	U+022b U+0024
ž$	ž	mīž, da mīž	WAZIRI, TORWALI, CHILASI, BASHGALI	10	U+017e U+0024
^ṇ	n̩	ṇa, ṇāsā	PRAKRIT, GHISADI	10	U+005e U+1e47
^ǔ	ǔ	ǔn, ǔn guai	KATURR	10	U+005e U+01d4
^kᵃw	kᵃw	kᵃwà pàṅ-deᵗ, kᵃwà ni wà	MARAN	10	U+005e U+006b U+1d43 U+0077
è	è	bèṭ’-, uwō kūṭèlā	RAJASTHANIMARWARI, BODOORBARA	10	U+00e8
é	é	bé mé, aitén	TAVOYAN, BASQUE, KHUN, LU, CHANG	10	U+00e9
ḇ	b̠	glau ḇo°, k’yeh ḇo°	TALAINGWRITTEN	10	U+1e07
nⁱ$	nⁱ	harnⁱ, hūnⁱ	KASHTAWARI, TELUGU, POGULI, KASHMIRI, BIHARIMAITHILI	10	U+006e U+2071 U+0024
åh	åh	båhå^k, manih prià kåh glàṅ	AKAKA, ASSAMESE, TALAINGSPOKEN, MUNDARI, KHERWARISANTHALI	10	U+00e5 U+0068
^sᵃ	sᵃ	sᵃmàṅ hä, sᵃbyå	THAYETMYOCHIN, NUNG, MARU	10	U+005e U+0073 U+1d43
^gg	gg	ggãū̃, ggāū̃	LARI, HINDKI, SINDHIVICHOLI	10	U+005e U+0067 U+0067
ks	ks	yáksa šō, miū pezaksinch	CHANG, WASIVERIORVERON, MONGOLIAN, KHANDESI	10	U+006b U+0073
åh$	åh	tsåh, måh	SEMANG, THAUCHU, TALAINGSPOKEN, MANYAK, BIHARIMAITHILI	10	U+00e5 U+0068 U+0024
lh	lh	tumᵃrā gēlhen, ilimi laki’lhokesá	KHARIA, SIRIPURIA, SEMA, BASQUE, JUANG, CHILASI	10	U+006c U+0068
sᵃ	sᵃ	tō asᵃtō, i-mā sᵃnä so	KHANDESI, INTHA, PASHAIEASTERN, LAI	10	U+0073 U+1d43
^gᵃ	gᵃ	gᵃ-s toṅ-ig, gᵃ bī-ē-g	KANAURI, BODOORBARA, WAZIRI	10	U+005e U+0067 U+1d43
^à̃	ã̀	à̃^ẽ, à̃k’à	DEURICHUTIYA, CENTRALPAHARIKUMAUNI, SINDHIVICHOLI, LARI	10	U+005e U+00e0 U+0303
^G	<?>	Gyåmi, Gōmōẽj	AKA, MALTOORMALER, LANTENYAO, KURKU, LAHU, MOPWADERMUHA, MOPWABILICHI, CANTONESE, WEWAW, SGASPOKEN	10	U+005e U+0047
A	<?>	Àpī mīyē, Àbkà-i ejen	AKAKA, MANCHU, MIKIR, EASTERNBENGALI, AHOM, CHAM, AKO, MALAY, KHMER, YACHUMI	10	U+0041
^M	<?>	Mu° sa° p’o°, Må-zå	SAKAI, LIMBU, BODOORBARA, LOLOPHO, LALUNG, MANCHATIORPATNI, DEURICHUTIYA, DIMASA, MARU, AHI	10	U+005e U+004d
ä̌$	ǎ̈	˧ gon ˦ ˦˨ līeṅ ˨ kä̌, å-ä̌	PALAUNG, SIAMESESPOKEN, SIAMESEWRITTEN, WA	9	U+00e4 U+030c U+0024
ṣ̌$	ṣ̌	aṣ̌, ɣwoṣ̌	PASHTOOFKANDAHAR, WAZIRI, SHINAGILGITI, AINU, ORMURI	9	U+1e63 U+030c U+0024
ī̃h$	ī̃h	nī̃h, dī̃h	TINAULI, GUJURIOFHAZARA, PADARI, BHADRAWAHI, KIUTHALI, RAMBANI, CHILASI	9	U+012b U+0303 U+0068 U+0024
dᵉ$	dᵉ	mundᵉ, adᵉ	LARI, KANARESE, TELUGU, MALAYALAM, PADARI	9	U+0064 U+1d49 U+0024
lⁱ$	lⁱ	mölⁱ, ts’ēlⁱ	KASHMIRI, TELUGU, KASHTAWARI, POGULI, PADARI, MOPWABILICHI	9	U+006c U+2071 U+0024
nᵃ$	nᵃ	achch’an-mārilninnᵃ, hunnᵃ	PADARI, MALAYALAM, POGULI, TELUGU	9	U+006e U+1d43 U+0024
^kᵉ	kᵉ	kᵉchē’, kᵉpeṅ	SAKAI, SEMANG	9	U+005e U+006b U+1d49
oo	oː	a ˨˩ tao ˨˩ mōn ˦˥ šia ˦˥ ma gooṅ, k’yod-kyis brduṅ yooṅ	MANLANTIEN, SALON, JUANG, BHOTIATIBETANWRITTEN	9	U+006f U+006f
ṅs$	ṅs	k’ō-s rduṅs, ṅa-raṅ-is rduṅs	BHOTIAOFPURIK, KANAURI, DHIMAL	9	U+1e45 U+0073 U+0024
φ	φ	˧ φa ˨˦ ša, ˧ φa = mu ˧ a ˨˦ ɣē	PWOLITERARY	9	U+03c6
^ä$	ä	ä, ä-	PALAUNG, LAHU, MARU, PADAUNG, GHEKO, YEINBA, SHINAGILGITI	9	U+005e U+00e4 U+0024
tᵘ$	tᵘ	k’ōtᵘ, pūtᵘ	KANARESE, KASHMIRI, TELUGU, MALAYALAM, RAMBANI, BIHARIMAITHILI	9	U+0074 U+1d58 U+0024
eᵏ	eᵏ	nān-chī cheᵏ-bauᵏ, s’a ˧ eᵏ dàᵏ	KHAMI, SIAMESESPOKEN, KADU	9	U+0065 U+1d4f
ös	ös	töst-, wöst	LAHU, PASHAIEASTERN, PASHAIWESTERN, SHIYNI, MOSHO	9	U+00f6 U+0073
^θw	θw	θwā, θwà	DANU, TAVOYAN, ARAKANESE, AVESTAN, PWOBASSEIN, TAUNGTHA, WEWAW	9	U+005e U+03b8 U+0077
t̤	tʱ	šait̤ān, šait̤ōn	ARABIC, PERSIAN, ORMURI, PASHTOOFPESHAWAR, WAZIRI, PASHTOOFKANDAHAR	9	U+0074 U+0324
^T	<?>	T’a-rāi, Trasken	RENGMA, TURKI, MANOE, MONGOLIAN, WAIALA, PURUM, MARING, MRU, SEMA	9	U+005e U+0054
dᵃh	dᵃh	gadᵃhā	MAGAHI, BHOJPURINORTHERN, KANAUJI, BRAJBHAKHA, NAGPURIA, BAGHELI, BIHARIMAITHILI, BHOJPURISOUTHERN, CHHATTISGARHI	9	U+0064 U+1d43 U+0068
ż	ż	panżōs, tᵃ żē	PASHTOOFPESHAWAR	8	U+017c
chw	chw	mās-chwē chwē, wās-chwē chwē	THULUNG, MOPWADERMUHA, EASTERNBENGALIOFCHITTAGONG	8	U+0063 U+0068 U+0077
ms	ms	timsoṅg, yemso-töl	KOREAN, KANAURI, KHARIA, ARABIC	8	U+006d U+0073
^ö$	ö	ö	MIRI, AKA, PADIPAHRIORPAHI, AKAKA, RUNGCHHENBUNG, CHAM, TAUNGYO, ABOR	8	U+005e U+00f6 U+0024
^dᵃ	dᵃ	dᵃ plārīnyē na, dᵃ pārīnyē	WAZIRI, PASHTOOFPESHAWAR	8	U+005e U+0064 U+1d43
aᵏ$	aᵏ	daᵏ, chikanaᵏ	MUNDARI, KHERWARISANTHALI, KHARIA, KADU	8	U+0061 U+1d4f U+0024
vv	vv	avve, devva	GADABA, IRULA, KODAGU, GONDI, KANARESE, BADAGA, KOTA	8	U+0076 U+0076
^pᵃ	pᵃ	pᵃ-do, pᵃša	THAYETMYOCHIN, PWOMAULMEIN, NUNG, LAI, GHEKO, WAZIRI	8	U+005e U+0070 U+1d43
ā̃s	ā̃s	mā̃su, pā̃su kaḍi	MAIYA, KUIKANDHIORKHOND, GUJARATISTANDARD, WAIALA, GAWARBATI, BRAJBHAKHA	8	U+0101 U+0303 U+0073
dⁱ$	dⁱ	nīnᵘ iddⁱ, nīn^ü iddⁱ	KANARESE, TELUGU, KODAGU, TAMIL	8	U+0064 U+2071 U+0024
’ᵃ	<?>	chel’ᵃrā, pak’ᵃru	EASTERNHINDIAWADHI, BIHARIMAITHILI, CHAROTARI, KHANDESI, BHILI	8	U+2019 U+1d43
ṛⁱ$	ṛⁱ	g’uṛⁱ, pūvaṅgōṛⁱ	KASHTAWARI, BIHARIMAITHILI, MALAYALAM, POGULI	8	U+1e5b U+2071 U+0024
üs	üs	tsüsā kutyeni, tüsā kutuyũ	CHILASIOFDAHHANU, KHMER, SARIKOLI, AKA	8	U+00fc U+0073
^šᵃ	šᵃ	šᵃdà, šᵃlà p’ē	NUNG, CHINGPAORKACHIN	8	U+005e U+0161 U+1d43
ꭓ́	ꭓ́	wēꭓ́t^a, chårj ꭓ́alg	PASHTOOFPESHAWAR, SARIKOLI, WAXI, MEGYAO, PHUNSAMONG	8	U+ab53 U+0301
zz	zz	tsǒzzarī jwānas, guzzi	KIUTHALI, KANAURI, POGULI	8	U+007a U+007a
iᶜʰ	iᶜʰ	dī-kū tiᶜʰ-kā-kū, ā-buṅg tiᶜʰ-kā-kū	KURKU, KHERWARISANTHALI	8	U+0069 U+1d9c U+02b0
̂	<?>	nô kia, nô	CHANG, LANTENYAO, GADI	8	U+0302
oᵏ$	oᵏ	boᵏ, kà-là-oᵏ	PWOMAULMEIN, SAKAI, PWOBASSEIN, PALAUNG, SIAMESESPOKEN, MALAY, YEINBA, KHAMI	8	U+006f U+1d4f U+0024
^ɣ́	ɣ́	ɣ́ik, ɣ́ö	MARU, MEGYAO, LISHAOYAOYIN, PHUNSAMONG	8	U+005e U+0263 U+0301
…	NONE	tà…gä, sei…ö	KATURR, WAXI, PHUNSAMONG, PWOLITERARY, SHIYNI	8	U+2026
äh$	äh	bäh-, däh	POTHWARI, MULTANI, THALI, DHANNI, TINAULIOFSALTRANGE, KATURR, LAHNDAOFSHAHPUR	8	U+00e4 U+0068 U+0024
ẹ	<?>	ki lẹ hö, vaẹnā-	GHEKO, AVESTAN	8	U+1eb9
i̯	i̯	hȫ ji̯àṅ, ñu ji̯àṅ	CHAM	8	U+0069 U+032f
^ō̃h	ō̃h	ō̃hē̃ jāch’ē, ō̃hē̃ ch’il	SIRIPURIA	8	U+005e U+014d U+0303 U+0068
^īw	īw	īwaḍāi se, īwaḍāi jāy-se	KATHIYAWADI, NICOBARESE	8	U+005e U+012b U+0077
^H	H	Hudā, Hā-rā	BANPARA, KOREAN, EASTERNBENGALI, EMPEO, SHOORKHYANG, HLOKE, THAYETMYOCHIN, BALOCHIMAKRANI	8	U+005e U+0048
^L	L	Lāi, Lā	ANAL, YINTALAE, MEITHEI, KABUI, MURMI, CHAIREL, SENGMAI, HIROILAMGANG	8	U+005e U+004c
^ṣ	ṣ	ṣaṭ, ṣā̃ṛ	SANSKRIT, BENGALIWRITTEN, KWOIRENG	7	U+005e U+1e63
^ḥ	ḥ	ḥujūr, ḥijr	ARABIC, GYPSYSYRIAN, HAURPA	7	U+005e U+1e25
^àh	àh	àhal, àhōn	MANCHU, AKO, KOREAN, AKAKA, CHAIREL	7	U+005e U+00e0 U+0068
^õ	õ	õ dā-la, õmbidi	NEWARI, BASHGALI, KORAVA, BHILI, HLOTA	7	U+005e U+00f5
^ä	ä	äm, äk	SAKAI, BENGALISPOKEN, MUNDARI, KHERWARISANTHALI, SZIORATSI, YEINBA, SHINAGILGITI	7	U+005e U+00e4
dᵉ	dᵉ	tandᵉ-gaḷ-indᵃ, tandᵉ-gaḷᵘ	KANARESE	7	U+0064 U+1d49
ǟ$	<?>	a-p’a-nǟ, gyap-nǟ	LADAKHIOFSPITI, BHOTIATIBETANSPOKEN, SINGHALESE	7	U+01df U+0024
^tt	tt	ttàrità, ttàrikeittà	KOREAN, PRAKRIT	7	U+005e U+0074 U+0074
ǎ̀$	à	ǎ̀-o͝u kǎ̀-mǎ̀, be kǎ̀-mǎ̀	KATURR	7	U+01ce U+0300 U+0024
eᶜʰ	eᶜʰ	am mundeᶜʰ-bā, dī-kō mundeᶜʰ-bā	KURKU, KHARIA	7	U+0065 U+1d9c U+02b0
^ǎ̀	à	ǎ̀-o͝u blam, ǎ̀-ǒu	KATURR	7	U+005e U+01ce U+0300
kh	kʰ	tkhreṅ-bu, ik-khālo	BASQUE, AKA, KHAMBU, KURUXORORAO, MISHMIDIGARU	7	U+006b U+0068
^ᵃš	ᵃš	ᵃše, ᵃšen nu-rā  tᵃ-kwā	TAUNGTHA, DANU, INTHA, TAVOYAN	7	U+005e U+1d43 U+0161
uᵗ$	uᵗ	mᵃhauᵗ, twuᵗ	KADU, ARAKANESE, MANCHATIORPATNI, KARENNI, TALAINGSPOKEN, YEINBA	7	U+0075 U+1d57 U+0024
ẹ$	<?>	nà θü lẹ, lẹ	GHEKO	7	U+1eb9 U+0024
ṛh	ṛh	mā̃ṛhā̃ᵗ, gṛham	ORIYA, KURKU, SANSKRIT, MUNDARI, BENGALIWRITTEN, KHERWARISANTHALI, BIHARIMAITHILI	7	U+1e5b U+0068
^˦˦˨	⁴⁴²	˦˦˨ kāǒ ˦ li, ˦˦˨ mē ˦ chʸeṅ ˦ mō	MIAOTSUHMONG	7	U+005e U+02e6 U+02e6 U+02e8
^ēh	ēh	ēhi, ēhōn ch’e	KHARAWA, WAR	7	U+005e U+0113 U+0068
jj$	jj	b’ajj-, ijj	THALI, PANJABIWRITTEN, DHANNI, TINAULIOFSALTRANGE, KURUXORORAO, PANJABISPOKEN, LAHNDAOFSHAHPUR	7	U+006a U+006a U+0024
ú	ú	hasa asúr, tu asús	KHOWARORCHITRALI, CHANG	7	U+00fa
īᶜʰ	īᶜʰ	dīᶜʰ dān, dīᶜʰ mundeᶜʰ-bā	KURKU	7	U+012b U+1d9c U+02b0
^sh	sh	she mārge, she hē	KANGRA	7	U+005e U+0073 U+0068
g̱	g̠	mū̃g̱ yū, mū̃g̱ żū	PASHTOOFPESHAWAR	7	U+0067 U+0331
ẓ̌	ẓ̌	mūẓ̌ wū, mūẓ̌ dzū	PASHTOOFKANDAHAR	7	U+1e93 U+030c
sⁱ	sⁱ	asⁱ ösⁱ, asⁱ ch’ih	KASHMIRI, KHOWARORCHITRALI	7	U+0073 U+2071
ōō$	ōō	māy-nēṅg bōō, mōō	GADABA	7	U+014d U+014d U+0024
åᵏ	åᵏ	sän-åᵏ-kan-ā-e, sän-åᵏ-kan-ā-bō	KHERWARISANTHALI, CANTONESE	7	U+00e5 U+1d4f
gᵃw	gᵃw	B’agᵃwān	MAGAHI, BHOJPURINORTHERN, BUNDELI, VERNACULARHINDOSTANI, BHILI, NAGPURIA, CHHATTISGARHI	7	U+0067 U+1d43 U+0077
ṟ$	ṟ	tåṟ, ǔw kuṟ	KATURR	6	U+1e5f U+0024
īw$	īw	k’ünnà° bà-snīw, brīw	KHASISTANDARD, ORMURI	6	U+012b U+0077 U+0024
^ṛ	ṛ	ṛå, ṛi-	KUIKANDHIORKHOND, BODOORBARA, THAMI, KURUXORORAO, TORWALI	6	U+005e U+1e5b
ǎh$	ǎh	tō̃ ch’alǎh, ō lokᵃni t’ikǎh	BIHARIMAITHILI, GYPSYSYRIAN, DODASIRAJI	6	U+01ce U+0068 U+0024
ì$	ì	ɣì, sū sö tì	MOPWABILICHI, TAUNGTHU, SGASPOKEN, MANOE	6	U+00ec U+0024
ṭṭ$	ṭṭ	kuṭṭ-, piṭṭ-	PRAKRIT, TELUGU, PANGWALI, POTHWARI, TODA	6	U+1e6d U+1e6d U+0024
aa$	aː	naa, tum’aĩ gaa	PRAKRIT, NACHHERENG, KANARESE, ORIYA	6	U+0061 U+0061 U+0024
^īs	īs	īsī, īsā	PERSIAN, MIKIR, KURKU, YAKHA, MUNDARI	6	U+005e U+012b U+0073
äs	äs	räsēi, bäs ṣ̌idōn	SHINAGILGITI, KARENBYU	6	U+00e4 U+0073
ås	ås	gåså, tsᵃh åsuk’	SAKUPA, KASHMIRI, SALON, THAUCHU	6	U+00e5 U+0073
ḅ	<?>	chi ḅui, baḅe° ḇo°	TALAINGWRITTEN, CHAM, MONGOLIAN	6	U+1e05
^bh	bh	bhoiyṯs̱, bhut	PADIPAHRIORPAHI, LALUNG, BAHING, DEURICHUTIYA, KANASHI, KACHCHHI	6	U+005e U+0062 U+0068
ṇᵃ$	ṇᵃ	goaṇᵃ, b’ēṇᵃ	MANCHATIORPATNI, SINDHIVICHOLI, KANARESE	6	U+1e47 U+1d43 U+0024
^ᵃs	ᵃs	ᵃs’ā, ᵃsu	MEGYAO, PHUNSAMONG, THAYETMYOCHIN, NUNG	6	U+005e U+1d43 U+0073
ěw	ěw	ch’ěwṛē, ch’ěwṛī	SIRMAURI	6	U+011b U+0077
m̌	m̌	am̌buva, um̌ba	SINGHALESE	6	U+006d U+030c
ṇᵘ	ṇᵘ	heṇṇᵘ makkaḷᵘ, heṇṇᵘ kudurᵉ-gaḷᵘ	KANARESE	6	U+1e47 U+1d58
^rs	rs	rstā, rstā-ṅum	BALTI, BHOTIAOFPURIK	6	U+005e U+0072 U+0073
ṛᵃw	ṛᵃw	g’uṛᵃwā, g’uṛᵃwai	EASTERNHINDIAWADHI, BHOJPURISOUTHERN	6	U+1e5b U+1d43 U+0077
rᵃw	rᵃw	g’urᵃwā, charᵃwāhu	KANAUJI, BUNDELI, EASTERNHINDIAWADHI	6	U+0072 U+1d43 U+0077
šᵘ$	šᵘ	pašᵘ, pišāšᵘ	TAMIL, MALAYALAM, KASHTAWARI	6	U+0161 U+1d58 U+0024
kᵉ$	kᵉ	aḍukkᵉ, blå f mö f tà lö ^ànà kᵉ	KANARESE, MOPWABILICHI, MALAYALAM, TELUGU	6	U+006b U+1d49 U+0024
kᵉ	kᵉ	kukᵉḍō, mēkᵉ-gaḷᵘ	GUJARATISTANDARD, KATHIYAWADI, GHISADI, LAI, KANARESE, CHAROTARI	6	U+006b U+1d49
^th	tʰ	the tien, thiu	KALASHA, SAKAI, THAMI	6	U+005e U+0074 U+0068
öö	öö	möö zàmi zà yåmyà, m^àmöö zami àbu	AKAKA	6	U+00f6 U+00f6
^lᵉ	lᵉ	lᵉaɣ-mō mī-un, lᵉaɣ-mō bū-striṅ-gun	BALTI, SAKAI, MARAN	6	U+005e U+006c U+1d49
^wh	wh	whāde ḍia-jenā, who hai	WESTERNHINDIHINDOSTANI, JUANG	6	U+005e U+0077 U+0068
ô	ô	nô kia, Gôn	CHANG, LANTENYAO	6	U+00f4
^ã$	ã	ã	KANAURI, PASHAIEASTERN, SANGPANG, NICOBARESE, PASHAIWESTERN, EASTERNPAHARIORKHASKURA	6	U+005e U+00e3 U+0024
I$	<?>	˦˥ chuṅ ˧ tōI, hā s’I	VIETNAMESE, BAHING, MALAYALAM, WAR, PHUNSAMONG	6	U+0049 U+0024
ụ̄	ụ̄	˧ yụ̄n, ˧ rụ̄ạn	SIAMESESPOKEN, SIAMESEWRITTEN	6	U+1ee5 U+0304
üh$	üh	šüh, trüh	YEINBA, ANGAMI, SEMA	6	U+00fc U+0068 U+0024
hⁱ	hⁱ	tǒhⁱ ch’iwa, tǒhⁱ ch’iwa gats’ān	KASHMIRI	6	U+0068 U+2071
chᵘ$	chᵘ	nī aḍichchᵘ, ñaṅṅaḷ aḍichchᵘ	MALAYALAM	6	U+0063 U+0068 U+1d58 U+0024
oᵏ	oᵏ	iṅg sän-oᵏ-ā, sän-oᵏ-tan-ā-pē	MUNDARI	6	U+006f U+1d4f
eᵃ	eᵃ	= ṅwà ˨ nū = yeᵃ ˧ lå, ˦ yī = yeᵃ ˧ lå	LISU	6	U+0065 U+1d43
aˡ$	aˡ	nàṅ-mà nᵃ-kaˡ, ᵃ-ni ᵏ-kaˡ	LAI	6	U+0061 U+02e1 U+0024
aˡ	aˡ	nᵃ-kaˡ li-kōm, kᵃ-kaˡ li-kōm	LAI	6	U+0061 U+02e1
gʸ	gʲ	tui gʸāt’nu, mui gʸāt’li	SOUTHWESTERNBENGALI	6	U+0067 U+02b8
^Ch	<?>	Chaiᵗ, Chidà	PWOMAULMEIN, PWOBASSEIN, KWOIRENG, PHUNSAMONG, SALON, OLDMEITHEI	6	U+005e U+0043 U+0068
^I	<?>	Išwar, Imra	ARABIC, KHAMBU, YAKHA, CHAKMA, BASHGALI	6	U+005e U+0049
^Pᵃ	<?>	Pᵃrā, Pᵃyā	ARAKANESE, DANU, INTHA, MAINGTHAORNGACHANG, TAVOYAN, TAUNGYO	6	U+005e U+0050 U+1d43
^ō̃	ȭ	ō̃der, ō̃r	BENGALISPOKEN, MISHMIDIGARU, EASTERNBENGALIOFCHITTAGONG	5	U+005e U+014d U+0303
^ꭓw	<?>	ꭓwà°, ꭓwula	THAUCHU, ORMURI, WAZIRI, SGASPOKEN	5	U+005e U+ab53 U+0077
^nh	nh	nhaṅ°, nhà ˨˩ k’ōṅ	BURMESEWRITTEN	5	U+005e U+006e U+0068
^mᵉ	mᵉ	mᵉnàṅ, mᵉjī’	SAKAI, SEMANG, TAVOYAN	5	U+005e U+006d U+1d49
yᵃ$	yᵃ	manuṣyᵃ, tagappaṉār-gaḷuḍeiyᵃ	KANARESE, TAMIL, PASHTOOFPESHAWAR, MANDARIN	5	U+0079 U+1d43 U+0024
gᵉ$	gᵉ	tandᵉ-gaḷi-gᵉ, keḷagᵉ	KANARESE, LARI	5	U+0067 U+1d49 U+0024
dᵃ$	dᵃ	ḍḍāndᵃ, uyarndᵃ	KANARESE, TAMIL, MALAYALAM, SINDHIVICHOLI	5	U+0064 U+1d43 U+0024
wᵃ	wᵃ	az bū tsawᵃm, āch’ī awᵃratᵃmā	NIMADI, ORMURI, KHANDESI	5	U+0077 U+1d43
öᵏ	öᵏ	˥˦ tsöᵏ ˩˨ nīu, klà böᵏ glàṅ	TALAINGSPOKEN, CANTONESE, MAINGTHAORNGACHANG	5	U+00f6 U+1d4f
^tᵉ	tᵉ	tᵉnē, tᵉbåh	SEMANG, SAKAI, BALTI	5	U+005e U+0074 U+1d49
^ꭓᵛ	ꭓᵛ	ꭓᵛar-, ꭓᵛāhar	AVESTAN, PAHLAVI, PERSIAN	5	U+005e U+ab53 U+1d5b
ṅh	<?>	eṅhai, niṅhai	KURUXORORAO, HLOTA, AVESTAN, GYAOMI	5	U+1e45 U+0068
ṭᵘ$	ṭᵘ	pēṭᵘ, nākāra koṭᵘ	SINDHIVICHOLI, KASHTAWARI, KASHMIRI, LARI	5	U+1e6d U+1d58 U+0024
zᵃ	zᵃ	sǔimā zᵃlā-fur, sǔimā zᵃlā	BODOORBARA	5	U+007a U+1d43
ns$	ns	hāns, yūgišans	RAIORJIMDAR, KHAMBU, THAMI, MAGARI, BURUSHASKI	5	U+006e U+0073 U+0024
^θⁱ	θⁱ	θⁱri pä, θⁱri mo	KARENBYU	5	U+005e U+03b8 U+2071
öᵏ$	öᵏ	klà böᵏ, krai böᵏ	TALAINGSPOKEN	5	U+00f6 U+1d4f U+0024
ǚᵏ	<?>	mǚᵏ kạ-mā, mǚᵏ à-t’ǖᵏ	PALAUNG	5	U+01da U+1d4f
uᵗ	uᵗ	˧ mouᵗ ˨˩ pā, ˧ mouᵗ ˧ wā dàᵏ	KADU	5	U+0075 U+1d57
ä̌	ǎ̈	˦ bä̌ ˧ tuà ˧ mīà, ˦ bä̌ ˧ tuà ˦˨ p’ū	SIAMESESPOKEN, SIAMESEWRITTEN, LADAKHIOFSPITI	5	U+00e4 U+030c
šš	šš	b’ālā mānuš-šakal, kiš-še ā̃-po	SUNWAR, CHAKMA, EASTERNBENGALI	5	U+0161 U+0161
^ii	iː	iip, ii onna-dachi	JAPANESE, WAR	5	U+005e U+0069 U+0069
gh	gh	nai ghou, mi ghou	HEMIAO, KURUXORORAO	5	U+0067 U+0068
^ᵃch	ᵃch	ᵃchàṅ je su cho, ᵃchàṅ je su cho ñåṅ	MAINGTHAORNGACHANG, TAUNGYO	5	U+005e U+1d43 U+0063 U+0068
