Grapheme	IPA	EXAMPLES	LANGUAGES	FREQUENCY	CODEPOINTS
^	NULL				
$	NULL				
a	NULL	ṅā, hā	SANGPANG, RUNGCHHENBUNG, MIRI, LOHORONG, MOPWABILICHI, SAKUPA, NICOBARESE, KARENBYU, SALON, KOREAN, GADABA, MISHMIDIGARU, KHERWARISANTHALI, SINHMAOMAEPAUK, ABOR, MONGOLIAN, PALAUNG, NEWARI, SHAN, PWOMAULMEIN, KARENNI, LU, GHEKO, SGASPOKEN, LIMBU, YAKHA, ZAVEIN, TALAINGWRITTEN, AHOM, DAFLA, WAR, DARANG, DHIMAL, NACHHERENG, RANGKAS, YEINBA, CHAMBALAHULI, MAGARI, MALAY, KHMER, DUNGMALI, BWE, HEMIAO, KHASISTANDARD, SIAMESEWRITTEN, KHAMTI, TAUNGTHU, WALING, MANCHATIORPATNI, VIETNAMESE, YINTALAE, TOTO, MANCHU, PWOBASSEIN, KHAMBU, WEWAW, PWOLITERARY, PADAUNG, EN, GURUNG, SGALITERARY, MAN, KANAURI, WA, TAILOI, MURMI, MIJU, SAKAI, BRAEO, KULUNG, SIAMESESPOKEN, KHUN, RONGORLEPCHA, LANTENYAO, MUNDARI, THAMI, KATURR, BALALI, TALAINGSPOKEN, YINRIANG	100	U+0061
̄	<?>	ṅā, ra-ṅā	SANGPANG, GYAOMI, LIMBU, BURUSHASKI, AIMOL, GADABA, MISHMIDIGARU, LANGRONG, NAMSANGIA, MIJU, BANPARA, LANTENYAO, LUSHEI, MARAM, CHIRU, MIRI, NEWARI, SHAN, MARING, LU, TIPURA, OLDMEITHEI, YAKHA, THADO, KOLHRENG, AHOM, DAFLA, BANJOGI, KHANGOI, DARANG, NACHHERENG, RODONGORCHAMLING, SINGPHO, DUMI, KABUI, CHAMBALAHULI, BHOTIATIBETANSPOKEN, RUNGCHHENBUNG, ANAL, BODOORBARA, MOSHANG, DUNGMALI, DIMASA, HALLAM, LOHORONG, PANKHU, SIAMESEWRITTEN, KHAMTI, WALING, MANCHATIORPATNI, BAHING, EMPEO, SIYIN, VAYUORHAYU, TOTO, KHAMBU, KWOIRENG, SUNWAR, HRANGKHOL, MEITHEI, BALTI, HLOTA, TAMLU, GURUNG, MAN, KANAURI, KOM, MIKIR, BHOTIAOFPURIK, PURUM, MURMI, KULUNG, SIAMESESPOKEN, KHOIRAO, CHAM, KHUN, RONGORLEPCHA, TABLENG, TANGKHUL, MUNDARI, THAMI, BALALI, TURKI, GAROACHIK, KEZAMA, YINRIANG	100	U+0304
_	_	NOTE: The tone contours used by the author of the text are inconsistent and inaccurate, θà θo dä mä	PADARI, KARENBYU, SIAMESEWRITTEN, BRAEO, MIAOTSUHMONG, MANOE, SIAMESESPOKEN, VIETNAMESE, YINTALAE, SHAN, PWOLITERARY, KARENNI, GHEKO, CANTONESE, SGALITERARY, BWE, MANDARIN, INTHA, ARAKANESE, LISU, LOLONI, KHMER, TALAINGSPOKEN, TAVOYAN, BURMESESPOKEN, MANLANTIEN, ANDRO, AHI, BURMESEWRITTEN, LOLOPHO, CHAIREL	100	U+005f
-	<?>	ra-ṅā, ma-ṅā	SANGPANG, RUNGCHHENBUNG, MIRI, LIMBU, YAKHA, CHAIREL, LOHORONG, SON, WALING, KHAMBU, HIROILAMGANG, SIHIA, GYAOMI, BALALI, RAIORJIMDAR, LUSHEI, MARAM, CHIRU, MARAN, ABOR, YACHUMI, MARING, GYAORUNG, OLDMEITHEI, KOLHRENG, DAFLA, BANJOGI, KHANGOI, ANGAMI, NACHHERENG, PHADANG, RODONGORCHAMLING, SINGPHO, MANYAK, KABUI, AIMOL, ANDRO, MEGYAO, MAGARI, AO, ANAL, MOSHANG, DUNGMALI, THAUCHU, HALLAM, PANKHU, SALON, TENGSA, BAHING, EMPEO, MISHMIDIGARU, SEMA, VAYUORHAYU, KWOIRENG, PADIPAHRIORPAHI, HRANGKHOL, MEITHEI, LANGRONG, HLOTA, KOM, NAMSANGIA, MIKIR, PURUM, BHOJPURISOUTHERN, MIJU, TAKPA, BANPARA, THUKUMI, KULUNG, KHOIRAO, SOPVOMA, RONGORLEPCHA, MRU, TANGKHUL, THULUNG, PHUNSAMONG, KEZAMA	100	U+002d
i	NULL	NOTE: The tone contours used by the author of the text are inconsistent and inaccurate, ch’ī	PADARI, LANTENYAO, GADABA, BURUSHASKI, HEMIAO, KHASISTANDARD, MANTAPAN, TAMIL, VAYUORHAYU, CHAM, MANLANTIEN, KANARESE, EN, GHEKO, MAN, LIMBU, TURKI, WA, KANAURI, KUIKANDHIORKHOND, AINU, TAKPA, MARAM, SARIKOLI, AKA, CHAMEALI, KOREAN, EMPEO, MANOE, MANCHATIORPATNI, KANGRA, AHOM, WAZIRI, GARHWALI, PASHTOOFKANDAHAR, GYAOMI, ABOR, DHIMAL, KHETRANI, TELUGU, MANCHU, MONGOLIAN, KHUN, TULU, ARABIC, SHAN, RANGKAS, CHAMBALAHULI, PWOLITERARY, SHIYNI, HRANGKHOL, DANAO, POWADHI, HLOTA, LU, MALAY, KHMER, SHINAGILGITI, KHARIA, MULTANI, SGALITERARY, IRULA, KOLAMI, HINDKI, MOSHO, MANDARIN, PASHTOOFPESHAWAR, TALAINGSPOKEN, BADAGA, MIJU, GADI	100	U+0069
u	NULL	NOTE: The tone contours used by the author of the text are inconsistent and inaccurate, tūk-chi	PADARI, GYAOMI, RUNGCHHENBUNG, MANCHATIORPATNI, SANGPANG, MONGOLIAN, GYAORUNG, JAPANESE, LOHORONG, SON, GADABA, VAYUORHAYU, MANCHU, MAN, SAVARA, AKA, MARAM, MARAN, MANOE, ISHKASHMIZEBAKI, GHEKO, LIMBU, SAKUPA, NICOBARESE, YAKHA, TALAINGWRITTEN, AHOM, BURUSHASKI, DHIMAL, RODONGORCHAMLING, DUMI, KABUI, RANGKAS, CHAMBALAHULI, GONDI, AO, KHMER, DUNGMALI, TENGSA, WALING, BAHING, YINTALAE, TOTO, KHAMBU, KWOIRENG, TULU, CHILASI, PWOLITERARY, PADIPAHRIORPAHI, SUNWAR, HLOTA, CANTONESE, GURUNG, SGALITERARY, KANAURI, WA, KURKU, MURMI, SAKAI, BRAEO, MIAOTSUHMONG, KHERWARISANTHALI, KULUNG, SIHIA, RONGORLEPCHA, LANTENYAO, DANAO, MUNDARI, THULUNG, CHILASIOFDAHHANU, SHINAGILGITI, KHARIA, BALALI, RENGMA, WAIALA, NUNG, BASHGALI, TODA	100	U+0075
n	NULL	ṅā, ṅa	RUNGCHHENBUNG, SANGPANG, LOHORONG, GYAORUNG, ZAVEIN, BURUSHASKI, GADABA, PADIPAHRIORPAHI, GURUNG, THULUNG, NUNG, KANASHI, SINHMAOMAEPAUK, ABOR, YACHUMI, MIRI, LISU, HLOKE, NEWARI, LADAKHI, KARENNI, AHI, GHEKO, NICOBARESE, YAKHA, LISHAOYAOYIN, LAHU, DANJONGKA, LADAKHIOFSPITI, AKAKA, DAFLA, BHOTIATIBETANWRITTEN, ANGAMI, NACHHERENG, RODONGORCHAMLING, KAGATE, MANYAK, DUMI, YEINBA, CHAMBALAHULI, BHOTIATIBETANSPOKEN, AKO, MAGARI, AO, DUNGMALI, SHARPA, TENGSA, TAUNGTHU, WALING, MANCHATIORPATNI, BAHING, KHALING, MISHMIDIGARU, VIETNAMESE, SEMA, YINTALAE, VAYUORHAYU, TOTO, MANCHU, KHAMBU, SUNWAR, PADAUNG, LOLONI, HLOTA, TAMLU, CANTONESE, KANAURI, LOLOPHO, NAMSANGIA, KURKU, MURMI, AINU, TAKPA, THUKUMI, KULUNG, SIHIA, SOPVOMA, RONGORLEPCHA, TABLENG, THAMI, CHANG, BALALI, GAROACHIK, KEZAMA	100	U+006e
ā	ā	sāt, pāch	RUNGCHHENBUNG, MIJU, SANGPANG, EASTERNBENGALI, CHAKMA, KIUTHALI, LANGRONG, EASTERNBENGALIOFCHITTAGONG, THAMI, KEZAMA, ORIYA, SOUTHWESTERNBENGALI, ASSAMESE, EASTERNHINDIAWADHI, GUJURIOFHAZARA, CHHATTISGARHI, KHAMI, BENGALISPOKEN, KHARAWA, NAGPURIA, LIMBU, MALTOORMALER, YAKHA, NICOBARESE, MUNJANIORMUNGI, MARATHIDESHI, BAGHELI, CHAROTARI, BHOJPURINORTHERN, KOLHRENG, NIMADI, WAR, BANJOGI, BIHARIMAITHILI, DARANG, MAIYA, NAGPURI, ARAKANESE, MAGAHI, NACHHERENG, RODONGORCHAMLING, KABUI, AIMOL, GONDI, ANDRO, MEGYAO, MAGARI, BRAJBHAKHA, MOSHANG, DUNGMALI, PADARI, LOHORONG, PANKHU, VERNACULARHINDOSTANI, WALING, INTHA, KHALING, DAKHINI, BENGALIWRITTEN, MISHMIDIGARU, KANAUJI, KHAMBU, PADIPAHRIORPAHI, HRANGKHOL, KHANDESI, NAMSANGIA, TAVOYAN, BHOJPURISOUTHERN, MANDEALI, KONKANI, CHILASIOFDRAS, KHERWARISANTHALI, KULUNG, WESTERNHINDIHINDOSTANI, SOPVOMA, EASTERNBENGALIOFCACHAR, MUNDARI, SIRIPURIA, CHILASIOFDAHHANU, DODASIRAJI, BALALI, SHODOCHI, GHISADI, WAXI, PHUNSAMONG, YINRIANG	100	U+0101
o	NULL	NOTE: The tone contours used by the author of the text are inconsistent and inaccurate, hōk	PADARI, SEMA, CHAIREL, KALASHA, BURUSHASKI, DUMI, RUNGCHHENBUNG, AO, DIMASA, GYAOMI, SOPVOMA, SAVARA, KHOWARORCHITRALI, KHARIA, GAROACHIK, RAIORJIMDAR, MANTAPAN, MANOE, SINHMAOMAEPAUK, YAWDWIN, MOPWADERMUHA, SHAN, GAWARBATI, BASQUE, ISHKASHMIZEBAKI, LU, AHI, TIPURA, BURMESEWRITTEN, MALTOORMALER, DANU, AHOM, NACHHERENG, KULUI, AKO, ANDRO, MEGYAO, BWE, SHOORKHYANG, MANDARIN, TENGSA, SON, SIAMESEWRITTEN, KHAMTI, BAHING, KHALING, SIYIN, PADIPAHRIORPAHI, DEURICHUTIYA, SUNWAR, HRANGKHOL, KASHMIRI, BHILI, HLOTA, TAMLU, MAN, LOLOPHO, MIKIR, KURKU, NAMSANGIA, CHINGPAORKACHIN, TAVOYAN, BHOJPURISOUTHERN, SAKAI, TAKPA, BANPARA, MIAOTSUHMONG, CHILASIOFDRAS, SIAMESESPOKEN, CHAM, CHINBON, KHUN, RONGORLEPCHA, TABLENG, MRU, THULUNG, SHINAGILGITI, TALAINGSPOKEN, PHUNSAMONG	100	U+006f
e	NULL	NOTE: The tone contours used by the author of the text are inconsistent and inaccurate, ch’ē	PADARI, THULUNG, AO, EMPEO, GADABA, RAMBANI, PANGWALI, TURKI, KURKU, TENGSA, ORMURI, ZAVEIN, SARIKOLI, KOREAN, AKA, THALI, SAKAI, AMOK, SIAMESEWRITTEN, KHAMTI, KHALING, THUKUMI, DAKHINI, KANGRA, TINAULIOFSALTRANGE, POTHWARI, PANJABISPOKEN, AHOM, WAR, SIAMESESPOKEN, BURUSHASKI, MISHMIDIGARU, ABOR, YACHUMI, MIRI, ANGAMI, PHADANG, POGULI, SOPVOMA, DHANNI, TINAULI, MANLANTIEN, DUMI, GUJURIOFHAZARA, TABLENG, MALVI, CHHATTISGARHI, BENGALISPOKEN, CHIBHALI, DANAO, BAGHATI, MEITHEI, MUNDARI, BASQUE, KASHMIRI, KIUTHALI, EN, TAMLU, CHANG, GURUNG, MULTANI, KASHTAWARI, MAN, OLDMEITHEI, SHODOCHI, PUNCHHI, KURUXORORAO, PASHAIWESTERN, KHASISTANDARD, PURUM, WAZIRI, LAHNDAOFSHAHPUR, DOGRI	100	U+0065
r	NULL	NOTE: The tone contours used by the author of the text are inconsistent and inaccurate, turūi	PADARI, RODONGORCHAMLING, KHMER, AO, THAUCHU, MANCHATIORPATNI, HIROILAMGANG, KHERWARISANTHALI, KANARESE, MUNDARI, NUNG, TALAINGSPOKEN, LUSHEI, CHIRU, YAWDWIN, YACHUMI, TELUGU, MONGOLIAN, MARING, KHAMI, LADAKHI, BASQUE, BURMESEWRITTEN, OLDMEITHEI, PEMIAO, SAKUPA, TALAINGWRITTEN, KOLHRENG, KORAVA, WAR, BHOTIATIBETANWRITTEN, KHANGOI, BANJOGI, KOTA, ARAKANESE, ANGAMI, PHADANG, SINGPHO, MANYAK, KAIKADI, KABUI, CHAMBALAHULI, AIMOL, GONDI, ANAL, BODOORBARA, MOSHANG, CHINBOK, HALLAM, KHASISTANDARD, EMPEO, GADABA, MISHMIDIGARU, KODAGU, KWOIRENG, HRANGKHOL, MEITHEI, BALTI, LANGRONG, HLOTA, KOM, NAMSANGIA, MIKIR, KURKU, CHINGPAORKACHIN, BHOTIAOFPURIK, PURUM, SAKAI, TAKPA, BANPARA, AINU, MIAOTSUHMONG, THUKUMI, KHOIRAO, SOPVOMA, RONGORLEPCHA, MRU, SAVARA, TANGKHUL, KATURR, KHARIA, IRULA, RENGMA, BADAGA	100	U+0072
m	NULL	sūm-chi, sum-paṅ	GHEKO, KARENBYU, KHMER, BURUSHASKI, SAKAI, SANGPANG, CHAM, RUNGCHHENBUNG, MALAY, RAIORJIMDAR, VIETNAMESE, YAWDWIN, LAMBICHHONG, TULU, PYENORPYIN, SAVARA, PADAUNG, GONDI, LANGRONG, CHINBOK, LOHORONG, MIJU, ZAVEIN, WALING, MANCHATIORPATNI, KORAVA, WAR, KHANGOI, ABOR, MIRI, TOTO, TELUGU, MONGOLIAN, KODAGU, MANCHU, RODONGORCHAMLING, KAIKADI, HLOKE, ARABIC, KANARESE, DANJONGKA, CHHINGTANG, MEITHEI, BASQUE, ANDRO, OLDMEITHEI, LIMBU, IRULA, DUNGMALI, SAKUPA, YAKHA, BADAGA, PANKHU, SALON	100	U+006d
t	NULL	NOTE: The tone contours used by the author of the text are inconsistent and inaccurate, pā̃ṯs̱	PADARI, EASTERNBENGALI, CHAROTARI, KANASHI, BURUSHASKI, SEMA, SANSKRIT, BASQUE, KASHMIRI, KASHTAWARI, KANAURI, THAUCHU, JAPANESE, BRAEO, MIJU, KOREAN, ZAVEIN, MIAOTSUHMONG, MANOE, KONKANI, ORIYA, AMOK, SINHMAOMAEPAUK, LARI, SINGHALESE, WAR, RAMBANI, NAGPURI, VIETNAMESE, ABOR, MIRI, YINTALAE, TOTO, KAGATE, POGULI, BHADRAWAHI, RANGKAS, DANJONGKA, KARENNI, DANAO, GYAORUNG, PADAUNG, THULUNG, THAMI, GAWARBATI, MEGYAO, HLOTA, KIUTHALI, WASIVERIORVERON, GYPSYEUROPEAN, NAGPURIA, DODASIRAJI, GURUNG, WA, TURKI, AVESTAN, BWE, LISHAOYAOYIN, SINDHIVICHOLI, MARATHIDESHI, TAVOYAN, SHARPA, MURMI, BHOJPURISOUTHERN, YINRIANG	100	U+0074
’	<?>	ch’a, ch’ē	RAIORJIMDAR, YACHUMI, BENGALISPOKEN, CHAROTARI, KHANGOI, PHADANG, TENGSA, KANGRA, KANAUJI, MIKIR, TANGKHUL, MULTANI, AKA, ORIYA, SOUTHWESTERNBENGALI, EASTERNHINDIAWADHI, LISU, PALAUNG, HLOKE, NEWARI, TINAULI, MARING, CHHATTISGARHI, EASTERNBENGALI, CHAKMA, KHARAWA, KACHCHHI, NAGPURIA, AHI, BURMESEWRITTEN, HINDKI, SAKUPA, BAGHELI, BHOJPURINORTHERN, TINAULIOFSALTRANGE, PANJABISPOKEN, WAR, RAMBANI, BIHARIMAITHILI, MAGAHI, NACHHERENG, SINGPHO, PANJABIWRITTEN, DUMI, HAURPA, CHIBHALI, BHOTIATIBETANSPOKEN, POWADHI, BRAJBHAKHA, MAGARI, MOSHO, CHINBOK, SHOORKHYANG, DOGRI, GUJARATISTANDARD, VERNACULARHINDOSTANI, KHALING, DAKHINI, BENGALIWRITTEN, RAJASTHANIMARWARI, VAYUORHAYU, DHANNI, PADIPAHRIORPAHI, BUNDELI, PRAKRIT, LOLONI, LOLOPHO, PUNCHHI, BANGARU, KURUXORORAO, BANAPHARI, BHOJPURISOUTHERN, SAKAI, THALI, AMOK, THUKUMI, LARI, POTHWARI, WESTERNHINDIHINDOSTANI, EASTERNBENGALIOFCHITTAGONG, KHETRANI, THAMI, SIRIPURIA, KHOWARORCHITRALI, JAIPURI, GHISADI, SINDHIVICHOLI, LAHNDAOFSHAHPUR	100	U+2019
̇	<?>	ṅā, ṅa	RUNGCHHENBUNG, SANGPANG, LOHORONG, GYAORUNG, PADIPAHRIORPAHI, THULUNG, NUNG, MARAM, MARAN, KANASHI, SINHMAOMAEPAUK, ABOR, MIRI, LISU, HLOKE, NEWARI, MARING, LADAKHI, AHI, GHEKO, OLDMEITHEI, YAKHA, LISHAOYAOYIN, LAHU, DANJONGKA, LADAKHIOFSPITI, ZAVEIN, AKAKA, DAFLA, BHOTIATIBETANWRITTEN, KHANGOI, ANGAMI, NACHHERENG, PHADANG, RODONGORCHAMLING, KAGATE, SINGPHO, MANYAK, DUMI, KABUI, YEINBA, CHAMBALAHULI, BHOTIATIBETANSPOKEN, AKO, MAGARI, AO, MOSHANG, DUNGMALI, SHARPA, TENGSA, TAUNGTHU, WALING, MANCHATIORPATNI, BAHING, KHALING, MISHMIDIGARU, SEMA, YINTALAE, VAYUORHAYU, TOTO, KHAMBU, KWOIRENG, SUNWAR, PADAUNG, LOLONI, HLOTA, TAMLU, CANTONESE, GURUNG, KANAURI, LOLOPHO, NAMSANGIA, MIKIR, CHINGPAORKACHIN, MURMI, TAKPA, THUKUMI, KULUNG, SIHIA, KHOIRAO, SOPVOMA, RONGORLEPCHA, TABLENG, TANGKHUL, CHANG, BALALI, GAROACHIK, KEZAMA	100	U+0307
̀	<?>	ṅà, dàlàpàn	TALAINGSPOKEN, MONGOLIAN, MANCHU, CHAM, GHEKO, MALAY, KHMER, KARENBYU, SON, VIETNAMESE, ANDRO, MEGYAO, THAUCHU, PHUNSAMONG, SALON, MARAN, AMOK, GYAOMI, SEMA, EN, CHANG, NUNG, HEMIAO, CHAIREL, YINRIANG, SAKAI, TAUNGTHU, AKAKA, MANOE, WAR, DARANG, YINTALAE, LISU, SINGPHO, YEINBA, SHIYNI, KARENNI, PADAUNG, DANAO, AKO, KATURR, WA, BODOORBARA, TAILOI, SAKUPA, LISHAOYAOYIN, CHINGPAORKACHIN, LAHU, KHASISTANDARD, LAI, TAUNGYO	100	U+0300
k	NULL	ā-keṅ-kå, tūk-chi	ARAKANESE, INTHA, MIRI, GYAOMI, ABOR, TAVOYAN, SANGPANG, RUNGCHHENBUNG, RAIORJIMDAR, RONGORLEPCHA, CHAIREL, SEMA, LOLONI, LANGRONG, MIKIR, AINU, SAKAI, SIAMESEWRITTEN, KOREAN, AKA, WALING, BAHING, DAFLA, KULUNG, SIHIA, SIAMESESPOKEN, NACHHERENG, LISU, MANCHU, RODONGORCHAMLING, KHAMBU, CHINBON, SHAN, HIROILAMGANG, PWOLITERARY, SUNWAR, ANDRO, AHI, TIPURA, CANTONESE, SGALITERARY, LIMBU, BALALI, ANAL, TURKI, DUNGMALI, LOLOPHO, SAKUPA, YAKHA, BODOORBARA, GAROACHIK, RENGMA, MUNJANIORMUNGI, JAPANESE, LOHORONG, PHUNSAMONG	100	U+006b
ā$	ā	ṅā, ra-ṅā	LANGRONG, EASTERNBENGALIOFCHITTAGONG, MAN, LUSHEI, NEWARI, ANGAMI, TAUNGTHA, LANTENYAO, MARAM, CHIRU, YAWDWIN, YACHUMI, ABOR, MIRI, PALAUNG, SHAN, MARING, CHAKMA, LU, TIPURA, BURMESEWRITTEN, OLDMEITHEI, MARATHIDESHI, GADI, DANU, THADO, KOLHRENG, AHOM, DAFLA, BURMESESPOKEN, BANJOGI, KHANGOI, WAR, PANGWALI, SINGPHO, RANGKAS, CHAMBALAHULI, AIMOL, BHOTIATIBETANSPOKEN, GONDI, ANAL, BODOORBARA, MOSHANG, DIMASA, CHINBOK, HALLAM, KHASISTANDARD, PANKHU, SIAMESEWRITTEN, KHAMTI, MANCHATIORPATNI, EMPEO, BAHING, MISHMIDIGARU, SIYIN, TOTO, KWOIRENG, HIROILAMGANG, HRANGKHOL, SUNWAR, MEITHEI, BALTI, HLOTA, TAMLU, GURUNG, KANAURI, KOM, NAMSANGIA, KURKU, BHOTIAOFPURIK, PURUM, MURMI, BANPARA, CHILASIOFDRAS, SIAMESESPOKEN, KHOIRAO, SOPVOMA, CHAM, KHUN, TABLENG, MRU, TANGKHUL, GYPSYSYRIAN, CHILASIOFDAHHANU, SHINAGILGITI, GAROACHIK	100	U+0101 U+0024
i$	i	ch’ai, nwi	GADABA, SANGPANG, MANCHATIORPATNI, KULUNG, KHAMBU, MANYAK, BALALI, YAKHA, THAUCHU, LOHORONG, KUIKANDHIORKHOND, PWOBASSEIN, HAURPA, RANGKAS, YEINBA, PWOMAULMEIN, SAVARA, PADAUNG, BASQUE, DUNGMALI, TAKPA, AKAKA, MIAOTSUHMONG, AMOK, BAHING, KHERWARISANTHALI, WAR, MOPWABILICHI, KHOIRAO, GYAOMI, SEMA, YACHUMI, KANAUJI, YINTALAE, KODAGU, LISU, PANJABIWRITTEN, MANLANTIEN, TULU, MOPWADERMUHA, KABUI, MARING, WEWAW, CHAMBALAHULI, PWOLITERARY, BUNDELI, PADIPAHRIORPAHI, SUNWAR, TANGKHUL, MUNDARI, CENTRALPAHARIKUMAUNI, KHOWARORCHITRALI, BRAJBHAKHA, JAIPURI, TIPURA, KHARIA, SGASPOKEN, PEMIAO, KURKU, BANGARU, NICOBARESE, MEWATI, PADARI, DIMASA, MIKIR, BANAPHARI, LAI, BAGHELI, KEZAMA	100	U+0069 U+0024
^…$	NONE	…	LAO, KHAMUK, LAMBICHHONG, CHAURASYA, CHHINGTANG, OLDPERSIAN, WALING, NACHHERENG, DUNGMALI, SANGPANG, DUMI, VAYUORHAYU, KOLAMI, HEMIAO, ZAVEIN, MANOE, SEMANG, MOENGLWE, SINHMAOMAEPAUK, KHALING, THUKUMI, KULUNG, KHANGOI, DARANG, YAWDWIN, YACHUMI, YINTALAE, PHADANG, RODONGORCHAMLING, KWOIRENG, PYENORPYIN, LANTENYAO, THULUNG, BALALI, MOSHANG, CHINBOK, ANGKU, LOHORONG, YINRIANG	100	U+005e U+2026 U+0024
̣	NONE	aṭṭ’, yeṭṭu	SANSKRIT, TAMIL, KODAGU, KANARESE, THALI, KHERWARISANTHALI, KORAVA, TINAULIOFSALTRANGE, POTHWARI, KOTA, TOTO, KAIKADI, DHANNI, TINAULI, TULU, PRAKRIT, GYPSYSYRIAN, MALAYALAM, GONDI, SHINAGILGITI, DODASIRAJI, MULTANI, BODOORBARA, IRULA, BADAGA, TODA, LAHNDAOFSHAHPUR, KUIKANDHIORKHOND, ORMURI, KALASHA, KOHISTANIGARWI, RAMBANI, MAIYA, PASHTOOFKANDAHAR, KHETRANI, TELUGU, KAGATE, PALAUNG, POGULI, CHAM, TORWALI, HAURPA, RANGKAS, CHIBHALI, SAVARA, MURMI, BHOTIATIBETANSPOKEN, MUNDARI, THAMI, GAWARBATI, ISHKASHMIZEBAKI, KASHMIRI, MAGARI, GURUNG, KANAURI, KASHTAWARI, HINDKI, MALTOORMALER, WAIALA, BASHGALI, KURUXORORAO, SHARPA, DANJONGKA, LADAKHIOFSPITI	100	U+0323
l	NULL	hlē, yēḷü	SANGPANG, BURUSHASKI, THULUNG, GADABA, CHAM, PYENORPYIN, MALAY, SALON, KOREAN, DHIMAL, SAVARA, CANTONESE, MANDARIN, TENGSA, SON, MARAM, MARAN, KADU, DAFLA, WAR, KHANGOI, MISHMIDIGARU, SIYIN, DARANG, ABOR, YACHUMI, VAYUORHAYU, KODAGU, MONGOLIAN, MANCHU, PANGWALI, PALAUNG, SOPVOMA, LAMBICHHONG, TULU, ARABIC, KANARESE, BHADRAWAHI, PWOLITERARY, KATURR, GAWARBATI, MEGYAO, EN, KHARIA, KEZAMA, PASHAIEASTERN, WA, TURKI, IRULA, KURKU, SAKUPA, CHAURASYA, PADARI, PASHAIWESTERN, MIJU	100	U+006c
s	NULL	šaš, NOTE: The tone contours used by the author of the text are inconsistent and inaccurate	PADARI, SANSKRIT, EASTERNBENGALI, LIMBU, AINU, MANOE, CHILASIOFDRAS, BURUSHASKI, BRAHUI, YINTALAE, CHINBON, PAHLAVI, CHILASI, BALOCHIMAKRANI, CHILASIOFDAHHANU, SHINAGILGITI, DODASIRAJI, AVESTAN, MOSHO, PERSIAN, KALASHA, ORMURI, KOHISTANIGARWI, TALAINGWRITTEN, KOREAN, MANTAPAN, MIAOTSUHMONG, AKAKA, BANJOGI, ANAL, RAMBANI, MAIYA, VIETNAMESE, PASHTOOFKANDAHAR, LISU, POGULI, TORWALI, NEWARI, BHADRAWAHI, YUDYA, SHAN, RANGKAS, YEINBA, HIROILAMGANG, BENGALISPOKEN, LADAKHI, SHIYNI, DEURICHUTIYA, TANGKHUL, LOLONI, GAWARBATI, GYPSYEUROPEAN, LANGRONG, WASIVERIORVERON, KASHMIRI, AHI, TIPURA, KASHTAWARI, PASHAIEASTERN, KANAURI, TURKI, PEMIAO, LOLOPHO, WAIALA, MOSHANG, MIKIR, BASHGALI, MUNJANIORMUNGI, LISHAOYAOYIN, PASHTOOFPESHAWAR, WAXI, LUSHEI, WAZIRI	100	U+0073
d	NULL	NOTE: The tone contours used by the author of the text are inconsistent and inaccurate, ḍḍāh	PADARI, TELUGU, TAMIL, LARI, BURUSHASKI, IRULA, KORAVA, KAIKADI, KANARESE, BADAGA, KHETRANI, KODAGU, TULU, MALAYALAM, BASQUE, KACHCHHI, HINDKI, KARENBYU, SINDHIVICHOLI, KUIKANDHIORKHOND, ORMURI, MANTAPAN, CHIRU, THALI, KANASHI, KHALING, BHOTIATIBETANWRITTEN, DARANG, PASHTOOFKANDAHAR, KOTA, MANCHATI, TOTO, MANCHU, PWOBASSEIN, YUDYA, PWOMAULMEIN, LADAKHI, SAVARA, BHOTIATIBETANSPOKEN, GONDI, THULUNG, KHARAWA, BALTI, EN, KHARIA, PATNI, MULTANI, BODOORBARA, BHOTIAOFPURIK, THAUCHU, MUNJANIORMUNGI, KHASISTANDARD, TODA, LADAKHIOFSPITI	100	U+0064
^k	k	ko, kū	YAWDWIN, GYAORUNG, TALAINGSPOKEN, KOLHRENG, ARAKANESE, RONGORLEPCHA, AIMOL, KOM, DANU, INTHA, DAFLA, ABOR, MIRI, THULUNG, BURMESEWRITTEN, CHINBOK, LAHU, TAVOYAN, MURMI, MIJU, TAUNGYO, TAKPA, KHAMTI, TAUNGTHU, ZAVEIN, THADO, AKAKA, MARAN, MANCHATIORPATNI, LASHIORLECHI, THUKUMI, AHOM, BURMESESPOKEN, SIHIA, KHOIRAO, MISHMIDIGARU, DHIMAL, VAYUORHAYU, KAGATE, SINGPHO, RODONGORCHAMLING, PWOBASSEIN, MAINGTHAORNGACHANG, NEWARI, MANLANTIEN, KHUN, CHINBON, SZIORATSI, CHAMBALAHULI, PADIPAHRIORPAHI, LANTENYAO, AKO, ANDRO, MEGYAO, LU, GURUNG, TAILOI, MOSHO, CHINGPAORKACHIN, LISHAOYAOYIN, SHOORKHYANG, CHAURASYA, THAYETMYOCHIN, JAPANESE, KHASISTANDARD, PANKHU, PHUNSAMONG, YINRIANG	100	U+005e U+006b
̌	<?>	šaš, šě	GYPSYEUROPEAN, BENGALISPOKEN, RAMBANI, DODASIRAJI, TALAINGSPOKEN, KOREAN, CHILASIOFDRAS, BURUSHASKI, BRAHUI, POGULI, CHINBON, PAHLAVI, CHILASI, EASTERNBENGALI, BALOCHIMAKRANI, KASHMIRI, CHILASIOFDAHHANU, TIPURA, KASHTAWARI, KANAURI, GAROACHIK, AVESTAN, MOSHO, WAZIRI, PERSIAN, DANU, AINU, KALASHA, KOHISTANIGARWI, MANTAPAN, AKAKA, MIAOTSUHMONG, MANCHATIORPATNI, MAIYA, VIETNAMESE, ASSAMESE, LISU, TORWALI, BHADRAWAHI, YUDYA, KULUI, YEINBA, LADAKHI, SHIYNI, DEURICHUTIYA, GYPSYSYRIAN, TANGKHUL, GYAORUNG, LOLONI, GAWARBATI, WASIVERIORVERON, EN, AHI, SHINAGILGITI, PASHAIEASTERN, MOSHANG, TURKI, PEMIAO, WAIALA, LOLOPHO, DIMASA, LISHAOYAOYIN, BASHGALI, MUNJANIORMUNGI, PASHTOOFPESHAWAR, TAVOYAN, WAXI	100	U+030c
̈	<?>	yä, ṅä	KARENBYU, WAR, BWE, BRAEO, ZAVEIN, MANOE, KODAGU, KARENNI, LOLOPHO, TALAINGSPOKEN, SALON, AKAKA, MIAOTSUHMONG, SINHMAOMAEPAUK, MOPWABILICHI, GYAOMI, TULU, KHAMI, BHOTIATIBETANSPOKEN, KASHMIRI, AHI, SGALITERARY, WA, RENGMA, MIJU, SIAMESEWRITTEN, TAUNGTHU, SARIKOLI, MARU, AKA, KHERWARISANTHALI, SIHIA, SIAMESESPOKEN, DHIMAL, MONGOLIAN, CHAM, WEWAW, KHANDESI, CHILASIOFDAHHANU, CHAROTARI, KEZAMA, SGASPOKEN, NUNG, LISHAOYAOYIN, THAYETMYOCHIN, LAHU, KHASISTANDARD, WAXI, TODA, TAUNGYO	100	U+0308
à	à	pàn, dàlàpàn	CHAM, MONGOLIAN, MALAY, KHMER, MEGYAO, THAUCHU, PHUNSAMONG, MANCHU, MARAN, TALAINGSPOKEN, CHAIREL, TAUNGTHU, VIETNAMESE, SEMA, YAWDWIN, SHIYNI, DANAO, PADAUNG, CHANG, KARENBYU, CHINBOK, SALON, YINRIANG, LASHIORLECHI, SAKAI, SARIKOLI, AMOK, WAR, GYAOMI, SINGPHO, MAINGTHAORNGACHANG, TABLENG, SZIORATSI, YEINBA, GYAORUNG, ANDRO, TAUNGTHA, EN, GHEKO, BODOORBARA, WA, TAILOI, CHINGPAORKACHIN, KHASISTANDARD, LAI, TAUNGYO	100	U+00e0
^t	t	tūk-chi, turūi	SANGPANG, PALAUNG, SAVARA, RUNGCHHENBUNG, AO, TALAINGSPOKEN, TALAINGWRITTEN, MANCHATIORPATNI, THUKUMI, GADABA, BURUSHASKI, YACHUMI, MRU, HIROILAMGANG, LANTENYAO, MEITHEI, KATURR, HLOTA, KHARIA, OLDMEITHEI, ANAL, SAKUPA, NICOBARESE, NUNG, MIKIR, LOHORONG, TENGSA, SAKAI, AINU, KOREAN, AMOK, WALING, KHALING, KHERWARISANTHALI, KULUNG, WAR, KHANGOI, MISHMIDIGARU, DHIMAL, ANGAMI, MONGOLIAN, RODONGORCHAMLING, KHAMBU, MANYAK, PHADANG, KAGATE, CHAM, RONGORLEPCHA, MARING, CHAMBALAHULI, KHAMI, DANAO, TANGKHUL, MUNDARI, BALTI, MALAY, MAN, KANAURI, LIMBU, BALALI, MOSHANG, PEMIAO, DUNGMALI, KURKU, YAKHA, HEMIAO, BHOTIAOFPURIK	100	U+005e U+0074
p	p	sum-paṅ, ˨ pät	RUNGCHHENBUNG, RAIORJIMDAR, SANGPANG, SAKAI, AINU, MUNDARI, MALAY, LOHORONG, KOREAN, MIAOTSUHMONG, KHALING, GADABA, WAR, RODONGORCHAMLING, KHAMBU, CHAM, DUMI, MEITHEI, WASIVERIORVERON, KHARIA, OLDMEITHEI, KURKU, TALAINGSPOKEN, SIAMESEWRITTEN, TALAINGWRITTEN, DAFLA, KULUNG, SIAMESESPOKEN, MISHMIDIGARU, PASHTOOFKANDAHAR, KOTA, ABOR, MIRI, SALON, SANSKRIT, SHAN, EASTERNBENGALI, BALOCHIMAKRANI, BASQUE, KHMER, CANTONESE, AVESTAN, DUNGMALI, MANDARIN, PASHTOOFPESHAWAR, KHASISTANDARD, TODA, PHUNSAMONG, KEZAMA, WAZIRI	100	U+0070
^m	m	ma-ṅā, masàt	MARAN, SINGPHO, MUNDARI, KHARIA, CHINGPAORKACHIN, SAKAI, TAMIL, GADABA, MEITHEI, OLDMEITHEI, MARAM, EMPEO, THUKUMI, KHERWARISANTHALI, KHANGOI, KHOIRAO, BURUSHASKI, BRAHUI, KWOIRENG, KANARESE, SAVARA, DANAO, HRANGKHOL, HLOTA, KURKU, JAPANESE, KUIKANDHIORKHOND, RAIORJIMDAR, TALAINGWRITTEN, AKA, AMOK, CHIRU, KORAVA, WAR, MISHMIDIGARU, KOTA, KODAGU, TELUGU, PHADANG, KAIKADI, TULU, AIMOL, DEURICHUTIYA, MALAYALAM, TANGKHUL, GONDI, KHMER, JUANG, MOSHANG, RENGMA, IRULA, KOLAMI, SHOORKHYANG, KURUXORORAO, HALLAM, TALAINGSPOKEN, BADAGA, TODA, CHAIREL	100	U+005e U+006d
y	NULL	NOTE: The tone contours used by the author of the text are inconsistent and inaccurate, rgyat	PADARI, RUNGCHHENBUNG, WALING, KWOIRENG, MIAOTSUHMONG, SINGHALESE, GADABA, TAMLU, MANTAPAN, DAFLA, GYAOMI, VAYUORHAYU, NEWARI, RONGORLEPCHA, OLDPERSIAN, DANAO, THULUNG, CANTONESE, MAN, MANDARIN, TAKPA, ORMURI, AMOK, BAHING, BHOTIATIBETANWRITTEN, BANJOGI, SIHIA, MISHMIDIGARU, KOTA, TELUGU, MANCHU, KODAGU, MONGOLIAN, SANSKRIT, HLOKE, TABLENG, RANGKAS, MARING, HIROILAMGANG, KHAMI, PWOLITERARY, LADAKHI, SHIYNI, BHOTIATIBETANSPOKEN, GYAORUNG, GONDI, MUNDARI, BALTI, BASQUE, MEGYAO, JAIPURI, SGALITERARY, SAKUPA, BHOTIAOFPURIK, PHUNSAMONG, SHARPA, DANJONGKA, BHOJPURISOUTHERN, LADAKHIOFSPITI	100	U+0079
^n	n	nau, nå̃	SANGPANG, AMOK, BALOCHIMAKRANI, ISHKASHMIZEBAKI, LIMBU, DARANG, LOHORONG, MANCHU, KASHTAWARI, MIJU, SARIKOLI, KANASHI, MONGOLIAN, TINAULI, MOPWADERMUHA, EASTERNBENGALI, GAWARBATI, OLDMEITHEI, HINDKI, MALTOORMALER, SAKUPA, YAKHA, MUNJANIORMUNGI, WAZIRI, KALASHA, ORMURI, ZAVEIN, TINAULIOFSALTRANGE, RAMBANI, MAIYA, DHIMAL, BRAHUI, SANSKRIT, YUDYA, PAHLAVI, RANGKAS, CHIBHALI, MAGARI, JAPANESE, PASHTOOFPESHAWAR, PERSIAN, KUIKANDHIORKHOND, KOHISTANIGARWI, TAUNGTHU, KOREAN, KHAMBU, POGULI, DHANNI, TORWALI, CHILASI, PRAKRIT, SUNWAR, PADAUNG, MEITHEI, KASHMIRI, TAMLU, GURUNG, PASHAIEASTERN, MIKIR, KURUXORORAO, PASHAIWESTERN, MURMI, TAKPA, THALI, MARU, CHILASIOFDRAS, POTHWARI, KULUNG, PASHTOOFKANDAHAR, KHETRANI, CHAM, TABLENG, SHIYNI, GYPSYSYRIAN, THAMI, KHOWARORCHITRALI, WASIVERIORVERON, CHILASIOFDAHHANU, SHINAGILGITI, DODASIRAJI, MULTANI, BALALI, AVESTAN, WAIALA, BASHGALI, WAXI, OLDPERSIAN, LAHNDAOFSHAHPUR	100	U+005e U+006e
ṅ	ṅ	ra-ṅā, ma-ṅā	RUNGCHHENBUNG, ABOR, MIRI, MARAM, GONDI, MARAN, GYAOMI, NAMSANGIA, BALALI, CHINGPAORKACHIN, SHOORKHYANG, THAYETMYOCHIN, LOHORONG, KEZAMA, LUSHEI, TAKPA, KUIKANDHIORKHOND, CHIRU, AKAKA, KOLHRENG, THUKUMI, BURMESESPOKEN, KULUNG, BHOTIATIBETANWRITTEN, KHANGOI, SIHIA, MISHMIDIGARU, KHOIRAO, BANJOGI, RENGMA, SEMA, ANGAMI, PHADANG, MANCHU, SINGPHO, SOPVOMA, KWOIRENG, CHINBON, RONGORLEPCHA, KABUI, MARING, MRU, HIROILAMGANG, PADIPAHRIORPAHI, LADAKHI, AIMOL, HRANGKHOL, TANGKHUL, LOLONI, MEITHEI, GYAORUNG, THULUNG, LANGRONG, ANDRO, HLOTA, MAGARI, GHEKO, AO, BURMESEWRITTEN, OLDMEITHEI, KOM, KHARIA, ANAL, MOSHANG, LIMBU, GAROACHIK, MIKIR, NUNG, NICOBARESE, YAKHA, MANDARIN, HALLAM, PANKHU, PURUM, CHAIREL, TENGSA	100	U+1e45
^b	b	bā, be	BASQUE, GADABA, BHOTIATIBETANWRITTEN, SAVARA, RUNGCHHENBUNG, JUANG, BODOORBARA, TURKI, RAIORJIMDAR, KHALING, KHERWARISANTHALI, SEMA, DUMI, PRAKRIT, MUNDARI, THULUNG, MAGARI, TIPURA, KHMER, KHARIA, GURUNG, GAROACHIK, NAMSANGIA, MOSHANG, KURKU, DIMASA, LOHORONG, WAXI, MURMI, CHAROTARI, GUJARATISTANDARD, SEMANG, MARU, MANCHATIORPATNI, KATHIYAWADI, KANASHI, KULUNG, DARANG, KHETRANI, VAYUORHAYU, RODONGORCHAMLING, KHAMBU, CHAMBALAHULI, KHARAWA, KATURR, KACHCHHI, BHILI, MALAY, SGASPOKEN, KANAURI, BALALI, WA, NUNG, GHISADI, TALAINGSPOKEN	100	U+005e U+0062
^p	p	panj, pañ	GYPSYEUROPEAN, RAMBANI, KASHTAWARI, SHINAGILGITI, LUSHEI, MANTAPAN, SARIKOLI, AKA, ORIYA, ABOR, YACHUMI, PALAUNG, TINAULI, KHAMI, EASTERNBENGALI, BALOCHIMAKRANI, GAWARBATI, ISHKASHMIZEBAKI, KACHCHHI, HINDKI, MALTOORMALER, MUNJANIORMUNGI, MARATHIDESHI, WAZIRI, KALASHA, ORMURI, TINAULIOFSALTRANGE, BANJOGI, KHANGOI, DARANG, MAIYA, NAGPURI, BRAHUI, ANGAMI, PHADANG, SANSKRIT, MANLANTIEN, YUDYA, PAHLAVI, KABUI, CHIBHALI, KHMER, AO, ANAL, PASHTOOFPESHAWAR, TENGSA, PERSIAN, SON, KOHISTANIGARWI, SEMA, POGULI, DHANNI, TORWALI, HIROILAMGANG, CHILASI, PRAKRIT, LANGRONG, KASHMIRI, EN, MAN, PASHAIEASTERN, WA, PUNCHHI, MIKIR, TAILOI, KURUXORORAO, PASHAIWESTERN, THALI, KONKANI, CHILASIOFDRAS, LARI, SINGHALESE, POTHWARI, PASHTOOFKANDAHAR, KHETRANI, SOPVOMA, SHIYNI, LANTENYAO, TANGKHUL, GYPSYSYRIAN, THAMI, KATURR, KHOWARORCHITRALI, CHILASIOFDAHHANU, DODASIRAJI, MULTANI, RENGMA, AVESTAN, WAIALA, NUNG, BASHGALI, TALAINGSPOKEN, SINDHIVICHOLI, WAXI, KEZAMA, LAHNDAOFSHAHPUR	100	U+005e U+0070
