Grapheme	IPA	EXAMPLES	LANGUAGES	FREQUENCY	CODEPOINTS
š	š	hašt, ˦˨ a ˨˦ ba ˨˦ še	EASTERNBENGALI, LOLONI, MEITHEI, CHAKMA, MANTAPAN, YUDYA, SUNWAR, MOSHANG, AKA, BURUSHASKI, EASTERNBENGALIOFCHITTAGONG, DHIMAL, TANGKHUL, GYAORUNG, KASHMIRI, AVESTAN, NICOBARESE, THAUCHU, MUNJANIORMUNGI, LAI, WAXI, KALASHA, AINU, ORMURI, KUIKANDHIORKHOND, TAKPA, MIAOTSUHMONG, ORIYA, MARU, KHAMTI, KANASHI, WAR, VIETNAMESE, GYAOMI, BRAHUI, LISU, KAGATE, SANSKRIT, ARABIC, MOPWADERMUHA, PAHLAVI, YEINBA, DEURICHUTIYA, GYPSYSYRIAN, BALOCHIMAKRANI, GAWARBATI, KHOWARORCHITRALI, LANGRONG, WASIVERIORVERON, TAMLU, CANTONESE, TAUNGYO, CHANG, KASHTAWARI, PASHAIEASTERN, KANAURI, RENGMA, WAIALA, DIMASA, BASHGALI, MIJU, PERSIAN	100	U+0161
w	NULL	michi-orowa, uwa	KADU, RUNGCHHENBUNG, SINGHALESE, AINU, MARAN, MANCHU, POWADHI, EN, MULTANI, TALAINGWRITTEN, THALI, AMOK, PHADANG, SZIORATSI, TANGKHUL, KACHCHHI, MEGYAO, WASIVERIORVERON, MALTOORMALER, CHINGPAORKACHIN, SHOORKHYANG, MIAOTSUHMONG, BAHING, KHALING, THUKUMI, SINHMAOMAEPAUK, KHANGOI, MISHMIDIGARU, DARANG, BURUSHASKI, PASHTOOFKANDAHAR, EASTERNBENGALIOFCHITTAGONG, YAWDWIN, MANYAK, DUMI, ARABIC, MOPWADERMUHA, MARING, PWOLITERARY, SAVARA, DANAO, CHAKMA, THAMI, KATURR, KHANDESI, BHOTIATIBETANSPOKEN, CANTONESE, SGALITERARY, MANDARIN, SINDHIVICHOLI, PASHTOOFPESHAWAR, PANKHU, SALON	100	U+0077
^y	y	yak, yä	BURUSHASKI, ABOR, WASIVERIORVERON, KOREAN, KOTA, THULUNG, PEMIAO, LOHORONG, BADAGA, KODAGU, TELUGU, MANLANTIEN, TULU, YUDYA, EASTERNBENGALI, MALAYALAM, SAVARA, GYPSYEUROPEAN, EASTERNPAHARIORKHASKURA, MAN, HEMIAO, JAPANESE, BRAEO, AKAKA, BAHING, KONKANI, BHOTIATIBETANWRITTEN, MOPWABILICHI, SIHIA, PASHTOOFKANDAHAR, DHIMAL, MONGOLIAN, PWOBASSEIN, PANGWALI, POGULI, SZIORATSI, PWOMAULMEIN, SHIYNI, SUNWAR, GYPSYSYRIAN, BHOTIATIBETANSPOKEN, GONDI, BALOCHIMAKRANI, GAWARBATI, SGASPOKEN, LIMBU, BALALI, TURKI, IRULA, KHAMUK, KURKU, BWE, KARENBYU, YAKHA, SAKUPA, MUNJANIORMUNGI, PADARI, BANAPHARI, PASHTOOFPESHAWAR, WAZIRI, PERSIAN	100	U+005e U+0079
z	NULL	ya s’zi, žā	PEMIAO, BASQUE, CHILASIOFDRAS, BWE, AO, MUNJANIORMUNGI, ORMURI, PASHTOOFKANDAHAR, YUDYA, CHILASIOFDAHHANU, MANDARIN, WAZIRI, SARIKOLI, GADABA, YACHUMI, ANGAMI, HLOKE, CHILASI, SHIYNI, LOLONI, HLOTA, RENGMA, PASHTOOFPESHAWAR, PERSIAN, AKA, MARU, MANCHATIORPATNI, THUKUMI, BHOTIATIBETANWRITTEN, MOPWABILICHI, MAIYA, EASTERNBENGALIOFCHITTAGONG, ASSAMESE, SEMA, HAURPA, CHAMBALAHULI, LADAKHI, LANTENYAO, BALTI, WASIVERIORVERON, MAGARI, KEZAMA, BODOORBARA, SHODOCHI, BHOTIAOFPURIK, MOSHO, THAUCHU, DANJONGKA	100	U+007a
å$	ḁ	ᵃpå, ti på	ABOR, MIRI, SAKUPA, SHAN, SIAMESEWRITTEN, SIAMESESPOKEN, DHIMAL, KHUN, HAURPA, LU, SARIKOLI, MARU, MAINGTHAORNGACHANG, LAHU, TAKPA, GYAOMI, BODOORBARA, BWE, TAUNGYO, LASHIORLECHI, ZAVEIN, BRAEO, MOPWABILICHI, MISHMIDIGARU, DARANG, PALAUNG, MANYAK, CHINBON, SZIORATSI, WEWAW, KHAMI, LANTENYAO, PADAUNG, ISHKASHMIZEBAKI, HLOTA, SGASPOKEN, SHOORKHYANG, LISHAOYAOYIN, CHINGPAORKACHIN, KARENBYU, THAYETMYOCHIN, SALON	100	U+00e5 U+0024
v	v	nava, duvē vappā	TANGKHUL, KORAVA, BRAHUI, SANSKRIT, AVESTAN, SARIKOLI, KAIKADI, KANARESE, PRAKRIT, OLDPERSIAN, THUKUMI, SEMA, DHIMAL, RANGKAS, SHIYNI, NAMSANGIA, LAHU, WAXI, TODA, KONKANI, SINGHALESE, KHANGOI, VIETNAMESE, ABOR, MIRI, PANJABIWRITTEN, TULU, YUDYA, PAHLAVI, TABLENG, POWADHI, GYPSYEUROPEAN, ISHKASHMIZEBAKI, HLOTA, AHI, MOSHANG, MOSHO, MUNJANIORMUNGI, LOHORONG	100	U+0076
ä	ä	b’äṇ, lä pà θi	KARENNI, KARENBYU, KHERWARISANTHALI, PWOBASSEIN, TALAINGSPOKEN, SIAMESEWRITTEN, SIAMESESPOKEN, PWOMAULMEIN, LOLONI, SGASPOKEN, SHINAGILGITI, PADAUNG, AHI, SALON, MOPWABILICHI, WEWAW, GHEKO, BWE, THAYETMYOCHIN, AKAKA, THALI, INTHA, TINAULIOFSALTRANGE, POTHWARI, YAWDWIN, ARAKANESE, HLOKE, DHANNI, TINAULI, MOPWADERMUHA, SZIORATSI, BHOTIATIBETANSPOKEN, MUNDARI, SGALITERARY, MULTANI, PUNCHHI, LOLOPHO, LAI, PHUNSAMONG, WAZIRI, LAHNDAOFSHAHPUR	100	U+00e4
^š	š	ši, šaš	AHOM, KHAMTI, CHINBON, EASTERNBENGALI, GYPSYEUROPEAN, ANDRO, MOSHO, DEURICHUTIYA, AINU, MARU, GYPSYSYRIAN, DODASIRAJI, WAIALA, BASHGALI, LUSHEI, MANOE, MARAN, KANASHI, MOPWADERMUHA, BENGALISPOKEN, LADAKHI, KARENNI, BALOCHIMAKRANI, GAWARBATI, AHI, TIPURA, BURMESEWRITTEN, PEMIAO, NICOBARESE, LISHAOYAOYIN, MUNJANIORMUNGI, LAHU, CHAIREL, WAZIRI, LADAKHIOFSPITI, KALASHA, AKAKA, BURMESESPOKEN, WAR, RAMBANI, MAIYA, ARAKANESE, BRAHUI, MANLANTIEN, BHADRAWAHI, YUDYA, PAHLAVI, YEINBA, CHAMBALAHULI, BHOTIATIBETANSPOKEN, CHINBOK, DIMASA, BWE, KHASISTANDARD, PASHTOOFPESHAWAR, SHARPA, SALON, TAUNGYO, PERSIAN, LASHIORLECHI, KOHISTANIGARWI, MANCHATIORPATNI, POGULI, TORWALI, CHILASI, HRANGKHOL, KASHMIRI, KASHTAWARI, PASHAIEASTERN, KANAURI, WA, LOLOPHO, CHINGPAORKACHIN, TAVOYAN, BRAEO, CHILASIOFDRAS, PASHTOOFKANDAHAR, SZIORATSI, TANGKHUL, CHILASIOFDAHHANU, WAXI	100	U+005e U+0161
^ṅ	ṅ	ṅā, ṅai	MARU, SZIORATSI, KHAMBU, TAMLU, SANGPANG, INTHA, PADAUNG, RUNGCHHENBUNG, GHEKO, ZAVEIN, SINHMAOMAEPAUK, DHIMAL, YEINBA, THULUNG, CHINBOK, LOHORONG, MURMI, LASHIORLECHI, THADO, TAUNGTHU, DANU, WALING, MANCHATIORPATNI, BAHING, KANASHI, THUKUMI, KULUNG, SIYIN, ARAKANESE, NACHHERENG, YINTALAE, TOTO, RODONGORCHAMLING, KAGATE, MANYAK, HLOKE, MAINGTHAORNGACHANG, NEWARI, HAURPA, TABLENG, CHAMBALAHULI, KHAMI, DANJONGKA, PADIPAHRIORPAHI, DEURICHUTIYA, SUNWAR, BHOTIATIBETANSPOKEN, AKO, ANDRO, TAUNGTHA, AHI, CHANG, GURUNG, KANAURI, BALALI, DUNGMALI, LOLOPHO, NUNG, YAKHA, CHINGPAORKACHIN, THAUCHU, LAHU, LAI, TAVOYAN, PANKHU, SHARPA, LADAKHIOFSPITI, TAUNGYO	100	U+005e U+1e45
ṛ	ṛ	lāṛī, g’ōṛā	GONDI, MUNDARI, RAMBANI, WESTERNPAHARIJAUNSARI, KHERWARISANTHALI, SIRMAURI, POGULI, SHODOCHI, KUIKANDHIORKHOND, ORMURI, TAMIL, THALI, KANASHI, SANSKRIT, KULUI, EASTERNBENGALIOFCACHAR, GAWARBATI, KIUTHALI, PUNCHHI, BHOJPURISOUTHERN, GADI, BHOJPURINORTHERN, MANDEALI, CHAMEALI, LALUNG, LARI, KANGRA, SOUTHWESTERNBENGALI, PASHTOOFKANDAHAR, RAJASTHANIMARWARI, KHETRANI, PANGWALI, TINAULI, BHADRAWAHI, YUDYA, CHILASI, CHAMBALAHULI, CHIBHALI, EASTERNBENGALI, BAGHATI, THAMI, KACHCHHI, BRAJBHAKHA, DODASIRAJI, KASHTAWARI, PASHAIEASTERN, MALTOORMALER, BASHGALI, KURUXORORAO, PASHAIWESTERN, SINDHIVICHOLI, PASHTOOFPESHAWAR, LAHNDAOFSHAHPUR, WAZIRI, DOGRI	100	U+1e5b
^w	w	wā, wāch-ch’ā	CHINGPAORKACHIN, SINGPHO, SAVARA, SHIYNI, ISHKASHMIZEBAKI, TAUNGTHU, MOPWABILICHI, DARANG, GYAOMI, PWOBASSEIN, TULU, YUDYA, WEWAW, YEINBA, PWOMAULMEIN, THULUNG, WASIVERIORVERON, SGASPOKEN, BALALI, BWE, LOHORONG, SON, THADO, AINU, SARIKOLI, RAIORJIMDAR, AKAKA, MANOE, AMOK, BAHING, SANGPANG, KULUNG, SIHIA, BURUSHASKI, PASHTOOFKANDAHAR, DHIMAL, ANGAMI, NACHHERENG, ARABIC, TABLENG, DANAO, PADAUNG, GHEKO, MOSHANG, MOSHO, THAUCHU, YAKHA, MUNJANIORMUNGI, KHASISTANDARD, PASHTOOFPESHAWAR, SALON, WAZIRI, YINRIANG	100	U+005e U+0077
ṭ	ṭ	āṭ’, aṭ’	WESTERNPAHARIJAUNSARI, EASTERNPAHARIORKHASKURA, KUIKANDHIORKHOND, ORIYA, SINGHALESE, KHARAWA, BENGALIWRITTEN, KHERWARISANTHALI, EASTERNBENGALIOFCACHAR, EASTERNBENGALI, SIRIPURIA, GONDI, KACHCHHI, JAIPURI, AVESTAN, MEWATI, KOHISTANIGARWI, BHOJPURINORTHERN, GUJARATISTANDARD, MANDEALI, VERNACULARHINDOSTANI, KURUX, MANCHATIORPATNI, KATHIYAWADI, KANASHI, LARI, DAKHINI, NIMADI, POTHWARI, PANJABISPOKEN, BIHARIMAITHILI, RAMBANI, WESTERNHINDIHINDOSTANI, MAIYA, NAGPURI, EASTERNBENGALIOFCHITTAGONG, ASSAMESE, GARHWALI, MAGAHI, RAJASTHANIMARWARI, KANAUJI, BURUSHASKI, KHETRANI, EASTERNHINDIAWADHI, TELUGU, SANSKRIT, PANJABIWRITTEN, TINAULI, KANARESE, KULUI, MALVI, CHHATTISGARHI, CHILASI, BUNDELI, CHIBHALI, SIRMAURI, KHANDESI, BAGHATI, THAMI, CENTRALPAHARIKUMAUNI, BRAJBHAKHA, KASHMIRI, NAGPURIA, BHILI, POWADHI, KASHTAWARI, HINDKI, SHODOCHI, GHISADI, KURUXORORAO, BANAPHARI, SINDHIVICHOLI, MARATHIDESHI, BAGHELI, BHOJPURISOUTHERN, CHAROTARI	100	U+1e6d
ǒ	ǒ	dǒš, pǒtrǎ	ASSAMESE, TIPURA, KOCH, AMOK, TALAINGSPOKEN, EN, ANGAMI, WESTERNPAHARIJAUNSARI, BHADRAWAHI, KULUI, BENGALISPOKEN, GYPSYSYRIAN, GYPSYEUROPEAN, GAROACHIK, SHODOCHI, TAILOI, BODOORBARA, NICOBARESE, TAVOYAN, DANU, SARIKOLI, MIAOTSUHMONG, KONKANI, POGULI, DANAO, CENTRALPAHARIKUMAUNI, KASHMIRI, KASHTAWARI, KOLAMI, PUNCHHI, DIMASA, MIJU	100	U+01d2
l$	l	zāl, -chal	GONDI, SAKAI, MEITHEI, KHARIA, OLDMEITHEI, CHAIREL, SARIKOLI, KOREAN, KHERWARISANTHALI, MUNDARI, PADARI, RAIORJIMDAR, DHIMAL, EASTERNBENGALI, GYPSYEUROPEAN, ISHKASHMIZEBAKI, TURKI, NUNG, TODA, YINRIANG, THADO, TAMIL, KOLHRENG, THALI, LALUNG, SEMANG, KONKANI, KHALING, MOENGLWE, DAFLA, KORAVA, GADABA, SIYIN, EASTERNBENGALIOFCHITTAGONG, KOTA, KHETRANI, KAIKADI, POGULI, DUMI, ARABIC, MARING, RANGKAS, EASTERNBENGALIOFCACHAR, AIMOL, HRANGKHOL, CHAKMA, WASIVERIORVERON, ANDRO, LANGRONG, BASQUE, KHMER, MULTANI, KOLAMI, HINDKI, KURKU, NICOBARESE, TAILOI, THAUCHU, KURUXORORAO, HALLAM, SENGMAI	100	U+006c U+0024
ḍ	ḍ	bāyᵃḍī, taṇḍrⁱ	TELUGU, GADABA, TAMIL, KAIKADI, TULU, KOTA, CHAROTARI, GUJARATISTANDARD, KHARAWA, KACHCHHI, JUANG, KATHIYAWADI, KHARIA, KONKANI, KANARESE, SAVARA, MALAYALAM, KHANDESI, GONDI, MALTOORMALER, BADAGA, KUIKANDHIORKHOND, THALI, KHALING, KORAVA, NIMADI, LABHANIOFBERAR, KODAGU, TINAULI, POWADHI, KURUXORORAO, TODA	100	U+1e0d
ä$	ä	trä, yä	KARENBYU, BRAEO, BWE, WEWAW, ZAVEIN, KARENNI, SHINAGILGITI, THAYETMYOCHIN, MARU, SINHMAOMAEPAUK, KHERWARISANTHALI, MOPWABILICHI, PWOBASSEIN, HLOKE, MAINGTHAORNGACHANG, PWOMAULMEIN, LADAKHI, PADAUNG, GHEKO, SGASPOKEN, SGALITERARY, LOLOPHO, PEMIAO, LISHAOYAOYIN, LAHU, SHARPA, DANJONGKA, DANU, SIAMESEWRITTEN, INTHA, KADU, BURMESESPOKEN, TINAULIOFSALTRANGE, POTHWARI, SIAMESESPOKEN, YAWDWIN, TINAULI, MOPWADERMUHA, SHAN, YEINBA, CHIBHALI, AHI, MAN, WA, PUNCHHI, MOSHO, MANDARIN, LAI, TAVOYAN, PHUNSAMONG, LAHNDAOFSHAHPUR	100	U+00e4 U+0024
^j	j	jaṇā, janānī	WAR, MANCHU, AVESTAN, MOSHO, AKA, BAGHATI, KHOWARORCHITRALI, JUANG, KURKU, SAKAI, MANCHATIORPATNI, KANGRA, TINAULIOFSALTRANGE, PANJABISPOKEN, MAGAHI, KOCH, PANGWALI, CHAMBALAHULI, CHIBHALI, EASTERNBENGALI, LANTENYAO, GYPSYSYRIAN, BALOCHIMAKRANI, SHINAGILGITI, GAROACHIK, DIMASA, KHASISTANDARD, RAIORJIMDAR, KOHISTANIGARWI, MANDEALI, KALASHA, MANOE, CHILASIOFDRAS, KATHIYAWADI, POTHWARI, BIHARIMAITHILI, GARHWALI, SIYIN, TOTO, MONGOLIAN, SANSKRIT, DHANNI, TINAULI, RANGKAS, MALVI, PADIPAHRIORPAHI, DEURICHUTIYA, PRAKRIT, GAWARBATI, GYPSYEUROPEAN, NAGPURIA, KEZAMA, RENGMA, NAMSANGIA, LADAKHIOFSPITI, BASHGALI, TALAINGSPOKEN, MURMI, CHAROTARI, DOGRI	100	U+005e U+006a
^u	u	um-ma, ulle āl	LOHORONG, LUSHEI, KULUNG, THULUNG, KHARIA, SHOORKHYANG, TODA, KHALING, DUMI, CHAM, EN, TURKI, DUNGMALI, SANGPANG, AKA, THUKUMI, MANCHU, MONGOLIAN, KAIKADI, ARABIC, SAVARA, GONDI, MUNDARI, WASIVERIORVERON, BASHGALI, THAYETMYOCHIN, JAPANESE, AINU, TAMIL, VERNACULARHINDOSTANI, KANASHI, KHERWARISANTHALI, DARANG, BURUSHASKI, PASHTOOFKANDAHAR, YAWDWIN, RODONGORCHAMLING, PALAUNG, KHAMBU, YUDYA, SZIORATSI, DANAO, THAMI, TAUNGTHA, TAMLU, BALALI, LOLOPHO, KURKU, CHINBOK, PASHTOOFPESHAWAR, PANKHU	100	U+005e U+0075
ü	ü	pü mü, künün	KEZAMA, WAR, MONGOLIAN, KHASISTANDARD, AHOM, YACHUMI, WAXI, BRAEO, SEMA, KHAMUK, RENGMA, AKA, MANTAPAN, MIAOTSUHMONG, VIETNAMESE, ANGAMI, PWOBASSEIN, PWOMAULMEIN, BHOTIATIBETANSPOKEN, CHILASIOFDAHHANU, SHOORKHYANG, BWE, MANDARIN, MIJU, KHAMTI, ZAVEIN, ORIYA, YINTALAE, HLOKE, KHUN, YEINBA, CHILASI, DANJONGKA, PRAKRIT, LANTENYAO, LU, SGALITERARY, MUNJANIORMUNGI, TODA	100	U+00fc
^	<?>	pà ^à-, pà d^àhà̃	MOPWADERMUHA, KARENBYU, KARENNI, BWE, SGASPOKEN, BRAEO, GHEKO, PWOBASSEIN, TULU, PWOMAULMEIN, WEWAW, YEINBA, TALAINGSPOKEN, DANAO, KASHMIRI, PADAUNG, MOPWABILICHI	100	U+005e
ö	ö	àpàji-töl-öikei, i-kön	WA, KOREAN, MOPWADERMUHA, KARENNI, KASHMIRI, PWOLITERARY, MOPWABILICHI, RUNGCHHENBUNG, BWE, WAZIRI, GHEKO, SGALITERARY, ANGKU, LASHIORLECHI, MANOE, MIAOTSUHMONG, MOENGLWE, SIHIA, VIETNAMESE, PADAUNG, TAUNGTHA, CANTONESE, LOLOPHO, SAKAI, TAUNGTHU, SEMANG, GYAOMI, MAINGTHAORNGACHANG, SHIYNI, DANAO, THULUNG, LOLONI, AHI, TURKI, TODA	100	U+00f6
^r	r	ra-ṅā, rgyat	LADAKHI, WA, SANGPANG, DUMI, THULUNG, BALTI, ISHKASHMIZEBAKI, BHOTIAOFPURIK, PANKHU, RAIORJIMDAR, KUIKANDHIORKHOND, AHOM, KORAVA, KAIKADI, SZIORATSI, MRU, OLDPERSIAN, HRANGKHOL, MALAYALAM, RUNGCHHENBUNG, GONDI, LANGRONG, TAUNGTHA, KANAURI, TAILOI, LAI, AINU, MIJU, AKA, CHIRU, KOLHRENG, BAHING, MANCHATIORPATNI, KANASHI, KHALING, GADABA, POTHWARI, KULUNG, GYAOMI, DHIMAL, VAYUORHAYU, TELUGU, RODONGORCHAMLING, KHAMBU, PALAUNG, MANYAK, TULU, ARABIC, HAURPA, RANGKAS, AIMOL, SUNWAR, EN, KOM, MOSHANG, KOLAMI, DUNGMALI, THAUCHU, HALLAM, LOHORONG, PURUM, LADAKHIOFSPITI	100	U+005e U+0072
^i	i	ikk, ik	NAMSANGIA, ORMURI, AINU, TAMIL, BRAHUI, LAMBICHHONG, HRANGKHOL, LANGRONG, KOM, IRULA, HALLAM, BURUSHASKI, KOTA, KHAMBU, KANARESE, MUNDARI, MALTOORMALER, YAKHA, PURUM, PERSIAN, KUIKANDHIORKHOND, SANGPANG, MANTAPAN, CHAMEALI, KANASHI, THUKUMI, KANGRA, DAFLA, KHERWARISANTHALI, PANJABISPOKEN, GADABA, WESTERNPAHARIJAUNSARI, RAMBANI, MISHMIDIGARU, MANCHATI, GYAOMI, RODONG, TELUGU, MANCHU, PANGWALI, PANJABIWRITTEN, DUMI, CHAM, TORWALI, ARABIC, MANLANTIEN, SZIORATSI, CHILASI, LANTENYAO, GYPSYSYRIAN, POWADHI, BALTI, BASQUE, WASIVERIORVERON, MALAY, DODASIRAJI, PATNI, KANAURI, KHARIA, KOLAMI, CHAMLING, KURKU, NICOBARESE, JAPANESE, DOGRI	100	U+005e U+0069
ā̃	ã̄	pā̃ch, bāpā̃-kō	MALVI, POTHWARI, RAJASTHANIMARWARI, THALI, DAKHINI, KANGRA, DHANNI, JAIPURI, MULTANI, BANGARU, MEWATI, WAIALA, LAHNDAOFSHAHPUR, CHAMEALI, TINAULIOFSALTRANGE, PANJABISPOKEN, EASTERNBENGALIOFCHITTAGONG, TINAULI, GUJURIOFHAZARA, CHIBHALI, POWADHI, DODASIRAJI, PUNCHHI, MARATHIDESHI, BAGHELI, BHOJPURINORTHERN, GUJARATISTANDARD, ORIYA, VERNACULARHINDOSTANI, KONKANI, BENGALIWRITTEN, WESTERNPAHARIJAUNSARI, BIHARIMAITHILI, WESTERNHINDIHINDOSTANI, LABHANIOFBERAR, SOUTHWESTERNBENGALI, MAIYA, NAGPURI, GARHWALI, MAGAHI, KANAUJI, EASTERNHINDIAWADHI, POGULI, RANGKAS, CHHATTISGARHI, BENGALISPOKEN, BUNDELI, EASTERNBENGALI, SIRMAURI, BAGHATI, SIRIPURIA, BALOCHIMAKRANI, CENTRALPAHARIKUMAUNI, BRAJBHAKHA, NAGPURIA, EASTERNPAHARIORKHASKURA, BANAPHARI, BHOJPURISOUTHERN	100	U+0101 U+0303
’$	<?>	āṭ’, aṭṭ’	ARABIC, EASTERNBENGALI, KASHTAWARI, SAKAI, KASHMIRI, NAGPURIA, KIUTHALI, CHAROTARI, WESTERNPAHARIJAUNSARI, KANASHI, GARHWALI, ASSAMESE, EASTERNHINDIAWADHI, TINAULI, GUJURIOFHAZARA, CHHATTISGARHI, SIRMAURI, KHARAWA, GYPSYEUROPEAN, HINDKI, MARATHIDESHI, BAGHELI, GADI, BHOJPURINORTHERN, SEMANG, TINAULIOFSALTRANGE, PANJABISPOKEN, NIMADI, RAMBANI, BIHARIMAITHILI, MAIYA, NAGPURI, MAGAHI, PANGWALI, PANJABIWRITTEN, BHADRAWAHI, KULUI, RANGKAS, MALVI, CHIBHALI, POWADHI, BAGHATI, BRAJBHAKHA, PADARI, KOHISTANIGARWI, GUJARATISTANDARD, VERNACULARHINDOSTANI, KATHIYAWADI, DAKHINI, BENGALIWRITTEN, KANGRA, RAJASTHANIMARWARI, KANAUJI, POGULI, DHANNI, BUNDELI, KHANDESI, CENTRALPAHARIKUMAUNI, BHILI, PUNCHHI, BANGARU, BANAPHARI, MANDEALI, THALI, CHAMEALI, POTHWARI, WESTERNHINDIHINDOSTANI, KHETRANI, MALAYALAM, THAMI, SIRIPURIA, JAIPURI, EASTERNPAHARIORKHASKURA, DODASIRAJI, MULTANI, SHODOCHI, MEWATI, GHISADI, LAHNDAOFSHAHPUR	100	U+2019 U+0024
ñ	ɲ	pañj, pañcha	MAINGTHAORNGACHANG, YACHUMI, LISU, YINRIANG, KUIKANDHIORKHOND, THUKUMI, ABOR, MIRI, AKAKA, DAFLA, AHOM, BHOTIATIBETANWRITTEN, TELUGU, SAVARA, JUANG, NICOBARESE, SIAMESEWRITTEN, MANDEALI, AKA, CHAMEALI, MARU, MIAOTSUHMONG, KANGRA, KORAVA, BURMESESPOKEN, MISHMIDIGARU, SEMA, PANGWALI, SANSKRIT, KAGATE, PANJABIWRITTEN, KAIKADI, HLOKE, KWOIRENG, PALAUNG, MANLANTIEN, GUJURIOFHAZARA, KULUI, RONGORLEPCHA, CHIBHALI, LADAKHI, PRAKRIT, MALAYALAM, POWADHI, BHOTIATIBETANSPOKEN, LOLONI, KATURR, BALTI, HLOTA, KASHMIRI, KIUTHALI, BURMESEWRITTEN, CHANG, SGASPOKEN, AVESTAN, SHODOCHI, PUNCHHI, RENGMA, MOSHO, BHOTIAOFPURIK, LISHAOYAOYIN, YAKHA, KURUXORORAO, SHARPA, DANJONGKA, LADAKHIOFSPITI, TENGSA, GADI, DOGRI	100	U+00f1
˦˨	⁴²	˦ ˦˨ mā ˧ tuà ˦˨ p’ū, zo° ˦˨ mä	SIAMESESPOKEN, SIAMESEWRITTEN, LOLONI, AHI, LOLOPHO, MIAOTSUHMONG, SHAN, SGALITERARY, MANDARIN, VIETNAMESE	100	U+02e6 U+02e8
˧	³	˨ à ˨ bà ˧ kwà ˧ bye, ˦ ˦˨ mā ˧ tuà ˧ mīà	KADU, SGALITERARY, LISU, BURMESESPOKEN, SIAMESEWRITTEN, SIAMESESPOKEN, PWOLITERARY, VIETNAMESE, LOLONI, AHI	100	U+02e7
ṇ	n̩	jaṇā, māhṇū	TELUGU, KAIKADI, KORAVA, KANGRA, PRAKRIT, GONDI, DODASIRAJI, RAMBANI, SANSKRIT, KANARESE, CENTRALPAHARIKUMAUNI, KURUXORORAO, TAMIL, ORIYA, LABHANIOFBERAR, PANGWALI, TULU, MALAYALAM, SHODOCHI, MALTOORMALER, BANGARU, GUJARATISTANDARD, MANDEALI, KURUX, VERNACULARHINDOSTANI, CHAMEALI, KATHIYAWADI, LARI, SINGHALESE, TINAULIOFSALTRANGE, PANJABISPOKEN, WESTERNPAHARIJAUNSARI, KOTA, DHANNI, TINAULI, BHADRAWAHI, KULUI, CHIBHALI, SAVARA, SIRMAURI, POWADHI, KHANDESI, BAGHATI, KIUTHALI, MULTANI, KOLAMI, PADARI, SINDHIVICHOLI, LAHNDAOFSHAHPUR, CHAROTARI, GADI	100	U+1e47
ā̃$	ã̄	d’īā̃, g’ōṛīā̃	TINAULIOFSALTRANGE, EASTERNBENGALI, KOHISTANIGARWI, BALOCHIMAKRANI, MOSHANG, LARI, KANGRA, WESTERNHINDIHINDOSTANI, PANJABIWRITTEN, TINAULI, BANGARU, LAHNDAOFSHAHPUR, THALI, POTHWARI, DAKHINI, RAMBANI, MAIYA, EASTERNHINDIAWADHI, PANGWALI, DHANNI, MALVI, CHAMBALAHULI, CHIBHALI, POWADHI, KACHCHHI, MULTANI, SINDHIVICHOLI, BAGHELI, DOGRI, VERNACULARHINDOSTANI, KATHIYAWADI, PANJABISPOKEN, WESTERNPAHARIJAUNSARI, RAJASTHANIMARWARI, KANAUJI, KOCH, BHADRAWAHI, GUJURIOFHAZARA, KULUI, CHILASI, BUNDELI, GADI, BAGHATI, BRAJBHAKHA, JAIPURI, DODASIRAJI, HINDKI, PUNCHHI, MEWATI, BANAPHARI	100	U+0101 U+0303 U+0024
^à	à	à pà, àyà	KOREAN, AKAKA, LAHU, MANCHU, MOPWADERMUHA, SAKAI, MANYAK, KHMER, SALON, ZAVEIN, CHAM, KARENBYU, BAHING, AKO, ANDRO, SON, TAKPA, SINHMAOMAEPAUK, GYAOMI, DHIMAL, MONGOLIAN, HAURPA, SZIORATSI, SHIYNI, PYENORPYIN, DANAO, KATURR, EN, MALAY, THAUCHU, TALAINGSPOKEN, CHAIREL, SENGMAI	100	U+005e U+00e0
ü$	ü	pfü, pü mü	TULU, KODAGU, PWOBASSEIN, BWE, BRAEO, KHAMI, PWOMAULMEIN, SGALITERARY, RENGMA, SHOORKHYANG, KEZAMA, MIAOTSUHMONG, ANGAMI, YEINBA, CHILASIOFDAHHANU, MIRI, MONGOLIAN, HLOTA, KASHMIRI, MIJU, SIHIA, VIETNAMESE, EASTERNBENGALIOFCACHAR, KHANDESI, AKO, WA, PEMIAO, NUNG, MOSHO, MANDARIN, CHAROTARI, TENGSA	100	U+00fc U+0024
tt	tt	kuttā, kuttī	PRAKRIT, DHANNI, AINU, TINAULIOFSALTRANGE, POTHWARI, KANARESE, CHIBHALI, MULTANI, LAHNDAOFSHAHPUR, TAMIL, THALI, CHAMEALI, KANGRA, SINGHALESE, PANJABISPOKEN, KHETRANI, PANJABIWRITTEN, TINAULI, TULU, BENGALISPOKEN, POWADHI, KACHCHHI, HINDKI, PUNCHHI, BADAGA, DOGRI, BHOJPURINORTHERN, SANGPANG, MANDEALI, VERNACULARHINDOSTANI, DAKHINI, NIMADI, WESTERNHINDIHINDOSTANI, GARHWALI, SOUTHWESTERNBENGALI, KOTA, RODONG, MAGAHI, RAJASTHANIMARWARI, KODAGU, PANGWALI, KAIKADI, CHINBON, GUJURIOFHAZARA, KULUI, CHAMBALAHULI, CHHINGTANG, BUNDELI, EASTERNBENGALI, MALAYALAM, BAGHATI, SIRIPURIA, BRAJBHAKHA, WASIVERIORVERON, IRULA, TURKI, CHAMLING, BANGARU, MEWATI, BASHGALI, KURUXORORAO, BANAPHARI	100	U+0074 U+0074
^˧	³	˧ mīà, ˧ wuà ˧ tuà ˦˨ p’ū	SGALITERARY, PWOLITERARY, VIETNAMESE, KADU, MIAOTSUHMONG, SIAMESEWRITTEN, LISU, SIAMESESPOKEN, LOLONI, BURMESESPOKEN, SHAN, MANDARIN, CANTONESE	100	U+005e U+02e7
°$	<?>	˦ abo°, ˨ aba°	AHI, LOLOPHO, BURMESESPOKEN, TALAINGWRITTEN, MANDARIN, LUSHEI, TOTO, LISU, MANYAK, BURMESEWRITTEN, DANU, TAKPA, GYAORUNG, SGALITERARY, THAUCHU, TAUNGYO, SANGPANG, AKAKA, MOPWABILICHI, DARANG, KHAMBU, LAMBICHHONG, BHOTIATIBETANSPOKEN, AKO, KHARIA, BALALI, SHOORKHYANG, LAHU, TAVOYAN	100	U+00b0 U+0024
θ	θ	lä pà θi, ˧ ka = θē ˧ mō = θī	PWOLITERARY, PWOBASSEIN, PWOMAULMEIN, KARENNI, EASTERNBENGALI, SGALITERARY, SGASPOKEN, KARENBYU, BRAEO, WEWAW, BWE, DIMASA, YAWDWIN, DANAO, AVESTAN, TAVOYAN, BURMESESPOKEN, ARAKANESE, ARABIC, YEINBA, OLDPERSIAN	100	U+03b8
s$	s	das, mānus	BHOTIATIBETANWRITTEN, GYAORUNG, LABHANIOFBERAR, SOUTHWESTERNBENGALI, KHARAWA, MALTOORMALER, BURUSHASKI, NAGPURI, PANJABIWRITTEN, POWADHI, MAGARI, GUJARATISTANDARD, VERNACULARHINDOSTANI, KANGRA, KHANDESI, BANGARU, GYPSYSYRIAN, SIRIPURIA, EASTERNPAHARIORKHASKURA, GHISADI, KANASHI, GARHWALI, EASTERNHINDIAWADHI, GUJURIOFHAZARA, CHHATTISGARHI, LADAKHI, CHAKMA, NAGPURIA, BAGHELI, WAZIRI, KALASHA, ORMURI, BHOJPURINORTHERN, PANJABISPOKEN, NIMADI, RAMBANI, BIHARIMAITHILI, MAGAHI, DUMI, YUDYA, PAHLAVI, MALVI, CHIBHALI, BRAJBHAKHA, PADARI, PASHTOOFPESHAWAR, PERSIAN, DOGRI, DAKHINI, RAJASTHANIMARWARI, KANAUJI, KODAGU, POGULI, CHILASI, BUNDELI, SUNWAR, CENTRALPAHARIKUMAUNI, BHILI, KASHMIRI, KASHTAWARI, PUNCHHI, BANAPHARI, MURMI, TAKPA, MANDEALI, CHAMEALI, KONKANI, POTHWARI, KULUNG, WESTERNHINDIHINDOSTANI, PASHTOOFKANDAHAR, THAMI, JAIPURI, DODASIRAJI, MEWATI, BASHGALI, WAXI	100	U+0073 U+0024
^ū	ū	ū-nū, ū-ma	VAYUORHAYU, DUNGMALI, CHHINGTANG, SANGPANG, KHALING, NACHHERENG, DUMI, KULUNG, RODONGORCHAMLING, HRANGKHOL, TURKI, HALLAM, LOHORONG, BANJOGI, THULUNG, CHIRU, MARING, RUNGCHHENBUNG, PANKHU, PURUM, THADO, SARIKOLI, KOLHRENG, SIYIN, HIROILAMGANG, KHAMI, AIMOL, LANGRONG, ISHKASHMIZEBAKI, KOM, CHAIREL	100	U+005e U+016b
^e	e	ek, eyan	TODA, MONGOLIAN, HLOTA, TAMIL, KANARESE, NICOBARESE, KOTA, EASTERNBENGALIOFCACHAR, BASQUE, KOREAN, MANCHU, GYPSYEUROPEAN, IRULA, WA, TAILOI, ANGKU, BASHGALI, KURUXORORAO, KALASHA, SAKAI, SON, AKA, CHILASIOFDRAS, SINGHALESE, BENGALIWRITTEN, KHERWARISANTHALI, SOUTHWESTERNBENGALI, ASSAMESE, TOTO, SANSKRIT, PHADANG, TULU, PRAKRIT, EASTERNBENGALI, MUNDARI, SIRIPURIA, KATURR, GAWARBATI, EASTERNPAHARIORKHASKURA, LIMBU, MALTOORMALER, WAIALA, BADAGA	100	U+005e U+0065
°	<?>	˧ mä° ˦ tä° ˧ lä° ˨ ta ˥˦ p’ā, zo° ˦˨ mä	AHI, LOLOPHO, PALAUNG, SGALITERARY, VAYUORHAYU, BURMESESPOKEN, BHOTIATIBETANSPOKEN, BURMESEWRITTEN, GAROACHIK, TALAINGWRITTEN, BAHING, KULUNG, LISU, LOHORONG, AKAKA, NACHHERENG, KHAMBU, LAMBICHHONG, CHHINGTANG, KHARIA, BALALI	100	U+00b0
ö$	ö	tö, θö	KARENNI, MOSHO, MOPWABILICHI, MOPWADERMUHA, AKO, GHEKO, SGASPOKEN, LOLOPHO, BWE, MANOE, WEWAW, BRAEO, GYAOMI, YEINBA, AHI, TAUNGYO, AKAKA, PADAUNG, HLOTA, SGALITERARY, LISHAOYAOYIN, SAKAI, AKA, BAHING, VIETNAMESE, ANGAMI, CHAM, PYENORPYIN, DANAO, LOLONI, TAUNGTHA, LAHU	100	U+00f6 U+0024
p$	p	bāp, dui bāp	RUNGCHHENBUNG, KOREAN, MIKIR, THADO, BHOJPURINORTHERN, GUJARATISTANDARD, DAKHINI, WESTERNHINDIHINDOSTANI, NAGPURI, EASTERNBENGALIOFCHITTAGONG, ASSAMESE, MAGAHI, RAJASTHANIMARWARI, EASTERNHINDIAWADHI, DUMI, TORWALI, BENGALISPOKEN, EASTERNBENGALIOFCACHAR, EASTERNBENGALI, LANTENYAO, THULUNG, CHAKMA, SIRIPURIA, NAGPURIA, JAIPURI, BANAPHARI, MARATHIDESHI, BAGHELI, BHOJPURISOUTHERN, SIAMESEWRITTEN, KHAMTI, MANTAPAN, KATHIYAWADI, KHALING, AHOM, DAFLA, BENGALIWRITTEN, NIMADI, SIAMESESPOKEN, BIHARIMAITHILI, VIETNAMESE, HLOKE, KHUN, MANLANTIEN, SHAN, MARING, MALVI, BUNDELI, BHOTIATIBETANSPOKEN, KHANDESI, GAWARBATI, MEGYAO, BHILI, LU, CHAROTARI, KHMER, CANTONESE, MAN, MEWATI, MIJU, TENGSA	100	U+0070 U+0024
d$	d	dānd, mard	SHIYNI, SARIKOLI, ARABIC, EASTERNBENGALI, ISHKASHMIZEBAKI, KASHTAWARI, HINDKI, PUNCHHI, SHODOCHI, WAXI, MANDEALI, THALI, KANASHI, TINAULIOFSALTRANGE, BHOTIATIBETANWRITTEN, LABHANIOFBERAR, GARHWALI, KAIKADI, DHANNI, TINAULI, GUJURIOFHAZARA, KULUI, BAGHATI, CENTRALPAHARIKUMAUNI, KASHMIRI, MULTANI, KANAURI, KOLAMI, TODA, LAHNDAOFSHAHPUR, PERSIAN, BHOJPURINORTHERN, VERNACULARHINDOSTANI, SEMANG, DAKHINI, WESTERNPAHARIJAUNSARI, MAGAHI, KANAUJI, MONGOLIAN, PANGWALI, BHADRAWAHI, RANGKAS, MALVI, CHAMBALAHULI, GONDI, GYPSYEUROPEAN, BHILI, KHARIA, MALTOORMALER, MEWATI	100	U+0064 U+0024
^v	v	vā, vaprē-b’yaḥ	PRAKRIT, SANSKRIT, NAMSANGIA, PALAUNG, SARIKOLI, MOPWABILICHI, SHIYNI, ZAVEIN, KARENNI, ISHKASHMIZEBAKI, BANPARA, BENGALIWRITTEN, KOTA, YINTALAE, KAIKADI, KACHCHHI, IRULA, MOSHANG, BADAGA, WAZIRI, GADABA, KORAVA, PANJABIWRITTEN, HAURPA, TABLENG, PAHLAVI, MALAYALAM, GURUNG, WAXI, TODA	100	U+005e U+0076
^o	o	ort, oṛo	KANARESE, JAPANESE, BASQUE, AINU, RONGORLEPCHA, MALAY, YAKHA, TAMIL, ASSAMESE, KHAMBU, KHARIA, KUIKANDHIORKHOND, KURUX, KODAGU, SAVARA, MALAYALAM, KHOWARORCHITRALI, KANAURI, WAIALA, KURUXORORAO, LASHIORLECHI, SON, BANPARA, KOREAN, SEMANG, LALUNG, MANCHATIORPATNI, DAFLA, KHERWARISANTHALI, KORAVA, BANJOGI, BHOTIATIBETANWRITTEN, TELUGU, MONGOLIAN, RODONGORCHAMLING, SOPVOMA, SZIORATSI, BENGALISPOKEN, LADAKHI, SUNWAR, MUNDARI, BALTI, GYPSYEUROPEAN, KASHMIRI, CHILASIOFDAHHANU, HLOTA, BALALI, MALTOORMALER, NICOBARESE, BASHGALI, SALON, LADAKHIOFSPITI	100	U+005e U+006f
^˦	⁴	˦ abo°, ˦ a ˦˨ no ˦˨ mo	LISU, LOLOPHO, MIAOTSUHMONG, MANDARIN, SHAN, SIAMESEWRITTEN, SIAMESESPOKEN, CANTONESE, LOLONI, AHI, SGALITERARY	100	U+005e U+02e6
^˨	²	˨ aba°, ˨ à ˨ bà	LISU, AHI, SIAMESEWRITTEN, SIAMESESPOKEN, MANDARIN, PWOLITERARY, VIETNAMESE, MANTAPAN, CANTONESE, SGALITERARY, SHAN, MANLANTIEN	100	U+005e U+02e8
ts	ts	˦˨ ts’a ˨˦ tsyo, ˨˦ nü ˦ hai tsz	JAPANESE, BHOTIATIBETANWRITTEN, BHOTIATIBETANSPOKEN, LISU, HLOKE, LOLONI, CANTONESE, LOLOPHO, THUKUMI, WAIALA, LISHAOYAOYIN, SHARPA, MARU, MANDARIN, DANJONGKA, AKAKA, MIAOTSUHMONG, MANCHATIORPATNI, KANASHI, YACHUMI, YUDYA, DANAO, AHI, RENGMA, SHODOCHI, BHOTIAOFPURIK, SAKAI, SEMA, BHADRAWAHI, GAWARBATI, KANAURI	100	U+0074 U+0073
h$	h	dah, noh	ARABIC, HEMIAO, KALASHA, ASSAMESE, WA, TALAINGSPOKEN, TALAINGWRITTEN, KATHIYAWADI, CHILASI, BALOCHIMAKRANI, KHOWARORCHITRALI, KASHMIRI, NICOBARESE, BASHGALI, CHAROTARI, ORMURI, BRAHUI, PAHLAVI, EASTERNBENGALI, SUNWAR, GAWARBATI, WASIVERIORVERON, MALAY, MALTOORMALER, SON, MIJU, AKA, SEMANG, THUKUMI, MAIYA, SEMA, KANAUJI, POGULI, NEWARI, YUDYA, KHAMI, ISHKASHMIZEBAKI, AHI, CHANG, KASHTAWARI, TURKI, AVESTAN, WAIALA, MUNJANIORMUNGI, PERSIAN	100	U+0068 U+0024
˨˩	²¹	˨ yēt ˨˩ tao ˨˩ yaṅ ˨˩ ṅuṅ ˨˩ ñāy, ˦˥ mē tàṅ ˦˥ ti ˨˩ tai ˨˩ nai ˨˩ mōn ˨˦ chʸàṅ	MANTAPAN, MANLANTIEN, BURMESESPOKEN, KADU, BURMESEWRITTEN, CANTONESE, VIETNAMESE	100	U+02e8 U+02e9
^z	z	zāl, zan	LOLOPHO, BASQUE, KASHTAWARI, MOSHO, PERSIAN, LAI, ZAVEIN, AKAKA, ISHKASHMIZEBAKI, AHI, BODOORBARA, WAR, RAMBANI, PASHTOOFKANDAHAR, KHETRANI, PAHLAVI, GAWARBATI, KASHMIRI, DODASIRAJI, ORMURI, AKA, THALI, LARI, MOPWABILICHI, SEMA, BRAHUI, ANGAMI, MANYAK, DHANNI, TINAULI, ARABIC, YUDYA, MOPWADERMUHA, HAURPA, SHIYNI, EASTERNBENGALI, BALOCHIMAKRANI, BALTI, MAGARI, AO, MULTANI, KANAURI, HINDKI, PADARI, THAUCHU, MUNJANIORMUNGI, THAYETMYOCHIN, SINDHIVICHOLI, WAXI, KEZAMA, WAZIRI	100	U+005e U+007a
