Grapheme	IPA	EXAMPLES	LANGUAGES	FREQUENCY	CODEPOINTS
^f	f	fā, fā-nē	LALUNG, BODOORBARA, KOCH, ARABIC, MOPWADERMUHA, HLOTA, ANGAMI, TANGKHUL, ISHKASHMIZEBAKI, LUSHEI, BANJOGI, MOPWABILICHI, GURUNG, MAN, BANPARA, MANLANTIEN, RONGORLEPCHA, MARING, HRANGKHOL, LANGRONG, TIPURA, DIMASA, JAPANESE, MANTAPAN, AKA, AMOK, SEMA, MANCHU, YUDYA, TABLENG, KABUI, LANTENYAO, SUNWAR, SHINAGILGITI, NICOBARESE, LAI	100	U+005e U+0066
j$	j	sūraj, panj	SARIKOLI, SHIYNI, KANASHI, KULUI, NIMADI, KHETRANI, SIRMAURI, KURKU, LARI, PANJABISPOKEN, RAMBANI, BRAHUI, PANJABIWRITTEN, BHADRAWAHI, PAHLAVI, POWADHI, KACHCHHI, BANGARU, PADARI, KALASHA, KOHISTANIGARWI, MANDEALI, BHOJPURINORTHERN, CHAMEALI, VERNACULARHINDOSTANI, MANCHATIORPATNI, KANGRA, POTHWARI, DAKHINI, WESTERNHINDIHINDOSTANI, MAGAHI, PANGWALI, SANSKRIT, KAIKADI, TORWALI, YUDYA, GUJURIOFHAZARA, RANGKAS, CHHATTISGARHI, CHIBHALI, EASTERNBENGALIOFCACHAR, EASTERNBENGALI, BUNDELI, GYPSYSYRIAN, BAGHATI, GADI, BALOCHIMAKRANI, SIRIPURIA, KHOWARORCHITRALI, GYPSYEUROPEAN, ISHKASHMIZEBAKI, BRAJBHAKHA, SHINAGILGITI, KANAURI, PASHAIEASTERN, KASHTAWARI, SHODOCHI, PUNCHHI, MALTOORMALER, MEWATI, MUNJANIORMUNGI, PASHAIWESTERN, BANAPHARI, BAGHELI, BHOJPURISOUTHERN, PERSIAN, DOGRI	100	U+006a U+0024
^ṭ	ṭ	ṭ’āṛ’ hō-, ṭuk	KHARAWA, BHILI, PRAKRIT, MALVI, KANAUJI, KATHIYAWADI, KULUI, GONDI, CENTRALPAHARIKUMAUNI, KIUTHALI, SINDHIVICHOLI, LADAKHIOFSPITI, KOHISTANIGARWI, ORIYA, MANCHATIORPATNI, LARI, WESTERNPAHARIJAUNSARI, BIHARIMAITHILI, EASTERNBENGALIOFCHITTAGONG, MAGAHI, RAJASTHANIMARWARI, TOTO, EASTERNHINDIAWADHI, KAGATE, PANGWALI, NEWARI, TORWALI, RANGKAS, CHHATTISGARHI, CHAMBALAHULI, BUNDELI, MURMI, BHOTIATIBETANSPOKEN, BAGHATI, SIRIPURIA, BRAJBHAKHA, NAGPURIA, JAIPURI, EASTERNPAHARIORKHASKURA, GURUNG, KANAURI, SHODOCHI, KURKU, BANAPHARI, PASHTOOFPESHAWAR, BAGHELI, SHARPA, DANJONGKA	100	U+005e U+1e6d
^ts	ts	tsü, tsā	MAN, SEMA, KEZAMA, NAGPURI, MRU, KASHTAWARI, MARATHIDESHI, RAMBANI, BHADRAWAHI, KASHMIRI, SHINAGILGITI, MOSHO, CHINGPAORKACHIN, LASHIORLECHI, SARIKOLI, MARU, CHILASIOFDRAS, THUKUMI, PASHTOOFKANDAHAR, SZIORATSI, DANAO, ISHKASHMIZEBAKI, KIUTHALI, CHILASIOFDAHHANU, RENGMA, CHAROTARI, TAUNGYO, ORMURI, MANCHATIORPATNI, SIHIA, WAZIRI, YACHUMI, ANGAMI, TELUGU, MANCHU, PHADANG, MANYAK, POGULI, CHAMBALAHULI, DANJONGKA, SHIYNI, KARENNI, TANGKHUL, HLOTA, KOLAMI, THAUCHU, JAPANESE, WAXI, SHARPA	100	U+005e U+0074 U+0073
^˩˨	<?>	˩˨ na ˦˥ dē, ˩˨ löǚ	CANTONESE, PANJABISPOKEN, MIAOTSUHMONG, HEMIAO	100	U+005e U+02e9 U+02e8
^kw	kʷ	kwi, kwe	TAUNGTHU, THAUCHU, INTHA, DANU, MARAN, LABHANIOFBERAR, ARAKANESE, YINTALAE, PALAUNG, KHUN, LU, CHINGPAORKACHIN, TAUNGYO, YINRIANG, TAVOYAN, BAHING, SZIORATSI, KATURR, MIJU, KANASHI, KHALING, SINHMAOMAEPAUK, KULUNG, MOPWABILICHI, SIYIN, PWOBASSEIN, CHINBON, MOPWADERMUHA, HAURPA, YEINBA, WEWAW, PWOMAULMEIN, PADAUNG, THULUNG, TAUNGTHA, GHEKO, AO, SGASPOKEN, LAI	100	U+005e U+006b U+0077
^ɣ	ɣ	ɣulām, ɣaz-	MUNJANIORMUNGI, YUDYA, MOPWADERMUHA, SHIYNI, ISHKASHMIZEBAKI, WAXI, BHOTIAOFPURIK, SARIKOLI, BALTI, GYPSYSYRIAN, LADAKHI, WAZIRI, ORMURI, MOPWABILICHI, BURUSHASKI, MONGOLIAN, WEWAW, PANJABISPOKEN, WESTERNHINDIHINDOSTANI, PASHTOOFKANDAHAR, SEMA, PWOBASSEIN, ARABIC, HAURPA, GUJURIOFHAZARA, PWOMAULMEIN, KHOWARORCHITRALI, SGASPOKEN, THAUCHU, PASHTOOFPESHAWAR	100	U+005e U+0263
ḍ$	ḍ	sā̃ḍ, ōḍ	KORAVA, IRULA, KHANDESI, BRAHUI, SAVARA, KASHTAWARI, TAMIL, KONKANI, KANGRA, WESTERNHINDIHINDOSTANI, NAGPURI, RAJASTHANIMARWARI, KODAGU, KAIKADI, KANARESE, MALVI, MALAYALAM, GONDI, BALOCHIMAKRANI, BHILI, KIUTHALI, JAIPURI, PUNCHHI, MARATHIDESHI, BADAGA, GUJARATISTANDARD, KOHISTANIGARWI, MANDEALI, THALI, ORIYA, KATHIYAWADI, KANASHI, WESTERNPAHARIJAUNSARI, NIMADI, TINAULIOFSALTRANGE, POTHWARI, KOTA, PASHTOOFKANDAHAR, EASTERNBENGALIOFCHITTAGONG, POGULI, DHANNI, TULU, KULUI, CHIBHALI, EASTERNBENGALI, SIRMAURI, BAGHATI, POWADHI, KACHCHHI, KASHMIRI, JUANG, EASTERNPAHARIORKHASKURA, MULTANI, SHODOCHI, HINDKI, PADARI, KURUXORORAO, TODA, CHAROTARI, LAHNDAOFSHAHPUR, DOGRI	100	U+1e0d U+0024
pp	pp	uppar, bāppū	TAMIL, PRAKRIT, VERNACULARHINDOSTANI, TULU, KODAGU, GUJURIOFHAZARA, LOHORONG, LAMBICHHONG, CHINBOK, KORAVA, PANJABIWRITTEN, BALALI, YAKHA, PANKHU, MURMI, RAIORJIMDAR, MARAM, CHAMEALI, KANGRA, DAFLA, LABHANIOFBERAR, ABOR, MAGAHI, MIRI, KOCH, KANARESE, CHIBHALI, KHANDESI, MEITHEI, LIMBU, BADAGA, CHAIREL, DOGRI	100	U+0070 U+0070
ñ$	ɲ	pañ, miñ	BURMESEWRITTEN, VIETNAMESE, MAN, MANTAPAN, KHERWARISANTHALI, THALI, TINAULIOFSALTRANGE, DHANNI, SHAN, BASQUE, MULTANI, HINDKI, LAHNDAOFSHAHPUR, SEMANG, LARI, POTHWARI, KHETRANI, TINAULI, MUNDARI, KACHCHHI, KASHMIRI, KASHTAWARI, KANAURI, SINDHIVICHOLI	100	U+00f1 U+0024
v$	v	nav, gav-	KONKANI, KASHMIRI, SARIKOLI, SHIYNI, GYPSYEUROPEAN, AVESTAN, CHAM, ISHKASHMIZEBAKI, WAXI, TODA, MOPWABILICHI, NAGPURI, KAIKADI, KOLAMI, BASHGALI, KALASHA, MUNJANIORMUNGI, MARATHIDESHI, PERSIAN, DAKHINI, SANSKRIT, YUDYA, EASTERNBENGALI, GYPSYSYRIAN, IRULA, PUNCHHI, TURKI, OLDPERSIAN, CHAROTARI	100	U+0076 U+0024
^ā$	ā	ā-, ā	MARING, HRANGKHOL, EASTERNBENGALI, BALOCHIMAKRANI, ANGAMI, RODONGORCHAMLING, BAGHATI, WALING, HLOTA, NAMSANGIA, MIKIR, TANGKHUL, RENGMA, LABHANIOFBERAR, GARHWALI, SOUTHWESTERNBENGALI, TINAULI, CHHATTISGARHI, BENGALISPOKEN, GAWARBATI, NAGPURIA, KIUTHALI, LIMBU, HINDKI, CHAURASYA, YAKHA, BAGHELI, GADI, KALASHA, BHOJPURINORTHERN, TALAINGWRITTEN, TINAULIOFSALTRANGE, WAR, BANJOGI, MAGAHI, PANGWALI, DUMI, KABUI, RANGKAS, MALVI, CHAMBALAHULI, CHHINGTANG, CHIBHALI, BRAJBHAKHA, HALLAM, PANKHU, BAHING, EMPEO, MANCHATIORPATNI, KHALING, DAKHINI, BENGALIWRITTEN, MISHMIDIGARU, VAYUORHAYU, DHANNI, TORWALI, BUNDELI, CENTRALPAHARIKUMAUNI, LANGRONG, TAMLU, PASHAIEASTERN, BANGARU, MANDEALI, THALI, CHAMEALI, AMOK, WESTERNPAHARIJAUNSARI, POTHWARI, WESTERNHINDIHINDOSTANI, KHETRANI, LAMBICHHONG, MRU, EASTERNBENGALIOFCACHAR, LANTENYAO, THULUNG, CHILASIOFDAHHANU, EASTERNPAHARIORKHASKURA, MULTANI, BALALI, SHODOCHI, MEWATI, TODA, KEZAMA, LAHNDAOFSHAHPUR	100	U+005e U+0101 U+0024
bb	bb	jibb’, babbā̃	KANGRA, RAMBANI, BANGARU, MALTOORMALER, DOGRI, CHAMEALI, DODASIRAJI, SOPVOMA, GADABA, KANARESE, PADARI, LADAKHIOFSPITI, BAGHATI, PASHTOOFPESHAWAR, KUIKANDHIORKHOND, MANDEALI, THALI, VERNACULARHINDOSTANI, PANJABISPOKEN, TINAULIOFSALTRANGE, POTHWARI, KORAVA, WAZIRI, PASHTOOFKANDAHAR, KHETRANI, PANJABIWRITTEN, DHANNI, BHADRAWAHI, KULUI, SHIYNI, CHIBHALI, PRAKRIT, EASTERNBENGALI, SUNWAR, GADI, MULTANI, BADAGA, LAHNDAOFSHAHPUR	100	U+0062 U+0062
ã	ã	ggãū̃, pãk’ērū	NEWARI, HINDKI, EASTERNBENGALI, WAIALA, LARI, SIRMAURI, GAWARBATI, EASTERNPAHARIORKHASKURA, LADAKHIOFSPITI, SEMANG, EASTERNHINDIAWADHI, RANGKAS, PADIPAHRIORPAHI, SINDHIVICHOLI, MARU, BHILI, KHARIA, MEWATI, KALASHA, SIAMESEWRITTEN, TAMIL, AKAKA, VERNACULARHINDOSTANI, KATHIYAWADI, CHILASIOFDRAS, KANGRA, TINAULIOFSALTRANGE, KORAVA, POTHWARI, NIMADI, MOPWABILICHI, RAJASTHANIMARWARI, DHANNI, BHADRAWAHI, PAHLAVI, MALVI, PYENORPYIN, PRAKRIT, JAIPURI, AVESTAN, BANGARU, NICOBARESE, BASHGALI, BAGHELI, TAUNGYO	100	U+00e3
ōh	ōh	lōhā, gōhṛī	KULUI, BAGHATI, PRAKRIT, MAIYA, KIUTHALI, SHODOCHI, KOHISTANIGARWI, TINAULIOFSALTRANGE, POWADHI, MULTANI, HINDKI, PADARI, LAHNDAOFSHAHPUR, BHOJPURINORTHERN, MAGAHI, PANJABIWRITTEN, TINAULI, NAGPURIA, MANDEALI, THALI, VERNACULARHINDOSTANI, CHAMEALI, KANGRA, BENGALIWRITTEN, POTHWARI, NIMADI, WESTERNPAHARIJAUNSARI, BIHARIMAITHILI, RAMBANI, WESTERNHINDIHINDOSTANI, LABHANIOFBERAR, KANAUJI, KHETRANI, PANGWALI, SANSKRIT, DHANNI, GUJURIOFHAZARA, CHHATTISGARHI, CHIBHALI, BUNDELI, EASTERNBENGALI, GADI, SIRIPURIA, BRAJBHAKHA, DODASIRAJI, PUNCHHI, BHOJPURISOUTHERN, DOGRI	100	U+014d U+0068
ẽ	ẽ	istriẽk šẽṛ, šarrẽ mardum	TAUNGYO, NAGPURIA, KALASHA, KONKANI, WAIALA, NICOBARESE, WASIVERIORVERON, EASTERNBENGALI, BALOCHIMAKRANI, NEWARI, BASHGALI, LAI, CHHATTISGARHI, KURKU, RAJASTHANIMARWARI, PADIPAHRIORPAHI, SEMANG, PANJABISPOKEN	100	U+1ebd
ās$	ās	pachās, hās	KHANDESI, MARATHIDESHI, CHILASI, GYPSYSYRIAN, WAIALA, KONKANI, KATHIYAWADI, CHILASIOFDRAS, KANGRA, DAKHINI, NIMADI, NAGPURI, BRAHUI, ARABIC, BHADRAWAHI, BUNDELI, EASTERNBENGALI, CHAKMA, MAGARI, EASTERNPAHARIORKHASKURA, BANGARU, GHISADI, PASHAIWESTERN, BANAPHARI, BHOJPURINORTHERN, GUJARATISTANDARD, VERNACULARHINDOSTANI, LALUNG, BENGALIWRITTEN, BIHARIMAITHILI, WESTERNHINDIHINDOSTANI, LABHANIOFBERAR, SOUTHWESTERNBENGALI, EASTERNBENGALIOFCHITTAGONG, GARHWALI, PASHTOOFKANDAHAR, MAGAHI, KANAUJI, RAJASTHANIMARWARI, ASSAMESE, EASTERNHINDIAWADHI, KHAMBU, KAIKADI, RANGKAS, MALVI, CHHATTISGARHI, EASTERNBENGALIOFCACHAR, SUNWAR, GONDI, THAMI, SIRIPURIA, CENTRALPAHARIKUMAUNI, KHOWARORCHITRALI, BRAJBHAKHA, NAGPURIA, JAIPURI, DODASIRAJI, SHINAGILGITI, PASHAIEASTERN, MEWATI, MUNJANIORMUNGI, KURUXORORAO, WAXI, BAGHELI, PASHTOOFPESHAWAR	100	U+0101 U+0073 U+0024
^=	<?>	= ṅwà, = nū ˦ tīᵃ ˧ lå	LISU, PWOLITERARY, SGALITERARY	99	U+005e U+003d
^ᵃp	ᵃp	ᵃpå, ᵃpā	MEGYAO, ARAKANESE, THAYETMYOCHIN, PHUNSAMONG, DANU, MARU, MAINGTHAORNGACHANG, TAVOYAN, TAUNGYO, NUNG, LAI, INTHA	99	U+005e U+1d43 U+0070
ḷ$	l̩	bāḷ, āgaḷ	TAMIL, MALAYALAM, CHAROTARI, GUJARATISTANDARD, KONKANI, KORAVA, KAIKADI, BHILI, RAJASTHANIMARWARI, BAGHATI, MARATHIDESHI, MANDEALI, VERNACULARHINDOSTANI, CHAMEALI, POTHWARI, PANJABISPOKEN, NAGPURI, PANGWALI, TINAULI, BHADRAWAHI, GUJURIOFHAZARA, KULUI, GADI, KIUTHALI, JAIPURI, SHODOCHI, PUNCHHI, MEWATI, GHISADI, LAHNDAOFSHAHPUR	94	U+1e37 U+0024
th	tʰ	NOTE: The tone contours used by the author of the text are inconsistent and inaccurate, gathu	PADARI, BASQUE, KALASHA, SAKAI, KOTA	93	U+0074 U+0068
^˥˦	⁵⁴	˥˦ mà ˦˨ på, ˥˦ kwå ˨˩ fū	PANJABISPOKEN, SGALITERARY, SHAN, CANTONESE, BURMESESPOKEN, ARAKANESE, MANTAPAN, PANJABIWRITTEN, KADU	93	U+005e U+02e5 U+02e6
hw	hw	ge  hwaiᵏ lǔ^ṟ^h, nar à-t’ūn hwit	PALAUNG, KATURR, CHINBON, BRAEO, BWE, WEWAW, PWOMAULMEIN, ZAVEIN, PWOBASSEIN, MANDARIN, BENGALIWRITTEN, MOPWADERMUHA, BIHARIMAITHILI	91	U+0068 U+0077
dd	dd	gadd’ā, tudd’ māreā	BADAGA, KANARESE, TINAULI, PRAKRIT, LADAKHIOFSPITI, LADAKHI, THAMI, KANGRA, TINAULIOFSALTRANGE, SOUTHWESTERNBENGALI, PANGWALI, KULUI, BRAJBHAKHA, KOLAMI, TODA, MANDEALI, AKA, THALI, BAHING, BENGALIWRITTEN, KORAVA, PANJABISPOKEN, DAKHINI, WAR, MISHMIDIGARU, GARHWALI, KOTA, TELUGU, POGULI, DHANNI, BENGALISPOKEN, EASTERNBENGALIOFCACHAR, MALAYALAM, DIMASA, NICOBARESE, KURUXORORAO, KHASISTANDARD, BAGHELI, LAHNDAOFSHAHPUR	91	U+0064 U+0064
ō̃	ȭ	kyō̃ hmōm, k’ō̃p-	CHILASIOFDRAS, VAYUORHAYU, BIHARIMAITHILI, MANDEALI, MAIYA, MAGAHI, GUJURIOFHAZARA, WESTERNHINDIHINDOSTANI, EASTERNBENGALIOFCHITTAGONG, CHILASIOFDAHHANU, PANJABIWRITTEN, NAGPURIA, BASHGALI, WESTERNPAHARIJAUNSARI, RODONGORCHAMLING, HLOTA, GADABA, KORAVA, VIETNAMESE, DHANNI, MALVI, CHHATTISGARHI, KACHCHHI, KIUTHALI, PASHAIEASTERN, PUNCHHI, KURUXORORAO, BHOJPURISOUTHERN	90	U+014d U+0303
ꭓ$	<?>	ūꭓ, lǒꭓ	PALAUNG, TODA, BHILI, ISHKASHMIZEBAKI, ORMURI, SHIYNI, EASTERNBENGALI, THAUCHU, KURUXORORAO, YUDYA, MUNJANIORMUNGI, GADI, SARIKOLI, PANJABISPOKEN, WESTERNHINDIHINDOSTANI, MAIYA, ASSAMESE, PERSIAN, TORWALI, ARABIC, GAWARBATI, PADARI, PASHTOOFPESHAWAR, WAXI	90	U+ab53 U+0024
^ā̃	ã̄	ā̃k’, ā̃k’i	EASTERNBENGALIOFCHITTAGONG, KACHCHHI, EASTERNBENGALI, KIUTHALI, JAIPURI, BUNDELI, BRAJBHAKHA, EASTERNPAHARIORKHASKURA, NICOBARESE, CHAROTARI, BHOJPURINORTHERN, GUJARATISTANDARD, ORIYA, VERNACULARHINDOSTANI, KATHIYAWADI, DAKHINI, GADABA, NIMADI, BIHARIMAITHILI, WESTERNHINDIHINDOSTANI, GARHWALI, SOUTHWESTERNBENGALI, MAGAHI, RAJASTHANIMARWARI, KANAUJI, MALVI, CHHATTISGARHI, SUNWAR, KHARAWA, BALOCHIMAKRANI, SIRIPURIA, BHILI, BANGARU, MEWATI, BANAPHARI, BAGHELI, BHOJPURISOUTHERN	90	U+005e U+0101 U+0303
rr	rr	ārr-k’oṅ, šarrẽ mardum	BASQUE, CHIRU, HLOTA, SAVARA, KOLHRENG, TELUGU, PURUM, ANGAMI, BALOCHIMAKRANI, GONDI, AKA, THUKUMI, YACHUMI, KOLAMI, SIAMESEWRITTEN, ORMURI, MARAM, DAFLA, KHANGOI, PHADANG, KAIKADI, PAHLAVI, SHIYNI, SUNWAR, LANGRONG, HINDKI, TAILOI, PERSIAN, YINRIANG	89	U+0072 U+0072
āh$	āh	pañjāh, pañāh	BHADRAWAHI, MULTANI, DHANNI, CHILASI, BALOCHIMAKRANI, NICOBARESE, MANDEALI, THALI, TINAULIOFSALTRANGE, NAGPURI, KHETRANI, PERSIAN, TINAULI, PAHLAVI, CHIBHALI, EASTERNBENGALI, GADI, BAGHATI, KASHMIRI, KIUTHALI, MUNJANIORMUNGI, CHAROTARI, LAHNDAOFSHAHPUR, KUIKANDHIORKHOND, AKA, CHAMEALI, SEMANG, CHILASIOFDRAS, KANGRA, WESTERNPAHARIJAUNSARI, POTHWARI, DAKHINI, AHOM, RAMBANI, BURUSHASKI, WAZIRI, MAGAHI, EASTERNHINDIAWADHI, PANGWALI, KHAMBU, PANJABIWRITTEN, POGULI, TORWALI, ARABIC, KULUI, POWADHI, KHANDESI, ISHKASHMIZEBAKI, KASHTAWARI, AVESTAN, HINDKI, SHODOCHI, PADARI, MARATHIDESHI, PASHTOOFPESHAWAR, OLDPERSIAN, DOGRI	88	U+0101 U+0068 U+0024
^ž	ž	ži, žā	MUNJANIORMUNGI, MANCHU, CHILASIOFDRAS, ASSAMESE, MOSHO, YUDYA, KHOWARORCHITRALI, WASIVERIORVERON, CHILASIOFDAHHANU, LADAKHI, ISHKASHMIZEBAKI, KALASHA, MAIYA, MANYAK, HLOKE, CHILASI, SHIYNI, WAXI, SARIKOLI, KANASHI, BHOTIATIBETANWRITTEN, BHOTIATIBETANSPOKEN, GAWARBATI, BHOTIAOFPURIK, PASHTOOFPESHAWAR, DANJONGKA	88	U+005e U+017e
^˨˧	²³	˨˧ k’au, ˨˧ såṅ	MANDARIN, SIAMESEWRITTEN, LOLONI, SIAMESESPOKEN, SHAN, MANTAPAN, MANLANTIEN, LOLOPHO, AHI, VIETNAMESE	87	U+005e U+02e8 U+02e7
ō̃$	ȭ	nō̃, mō̃	MARATHIDESHI, BUNDELI, WESTERNPAHARIJAUNSARI, NAGPURIA, DHANNI, BASHGALI, MANDEALI, TINAULIOFSALTRANGE, POTHWARI, GUJURIOFHAZARA, CHILASIOFDRAS, PANJABIWRITTEN, TINAULI, CHAMBALAHULI, POWADHI, KACHCHHI, JAIPURI, KASHTAWARI, HINDKI, SINDHIVICHOLI, KALASHA, GUJARATISTANDARD, SANGPANG, THALI, KONKANI, LARI, GADABA, BIHARIMAITHILI, MAIYA, MAGAHI, KHETRANI, TOTO, CHAM, MALVI, PADIPAHRIORPAHI, CHIBHALI, HLOTA, BHILI, CHILASIOFDAHHANU, JUANG, PUNCHHI, LAHNDAOFSHAHPUR	87	U+014d U+0303 U+0024
^ǎ	ǎ	ǎǔr, ǎǐyāl	GYPSYSYRIAN, LISHAOYAOYIN, GYPSYEUROPEAN, MAGAHI, BENGALISPOKEN, THALI, TINAULIOFSALTRANGE, SHINAGILGITI, NAGPURIA, BHOJPURISOUTHERN, BURMESEWRITTEN	85	U+005e U+01ce
^tw	tw	twi, twi pà	TAUNGTHU, MOPWABILICHI, PWOBASSEIN, YEINBA, WEWAW, PWOMAULMEIN, KARENNI, PADAUNG, GHEKO, SGASPOKEN, KARENBYU, SINHMAOMAEPAUK, ZAVEIN, YINTALAE, CHINBON, DANAO, BANAPHARI, WALING, YAWDWIN, TOTO, PHADANG, MRU, CENTRALPAHARIKUMAUNI, MEGYAO, TAUNGTHA, PEMIAO, DUNGMALI, CHAURASYA, BAGHELI, SALON, YINRIANG	83	U+005e U+0074 U+0077
ēs	ēs	tū̃ marēsē̃, mä̃ marēsā̃	TINAULIOFSALTRANGE, DHANNI, MULTANI, HINDKI, THALI, PRAKRIT, LAHNDAOFSHAHPUR, CHILASIOFDRAS, NAGPURIA, KURUXORORAO, DUMI, GYPSYSYRIAN, CHILASIOFDAHHANU, BANAPHARI, KUIKANDHIORKHOND, BHOJPURINORTHERN, MANDEALI, MANCHATIORPATNI, RAMBANI, MAGAHI, BRAHUI, PANGWALI, BUNDELI, SHIYNI, EASTERNBENGALI, BAGHATI, GADI, KACHCHHI, BRAJBHAKHA, JAIPURI, DODASIRAJI, LIMBU, PASHAIWESTERN, BAGHELI, DOGRI	80	U+0113 U+0073
õ	õ	hõ wõ-gu du, yõ-nau	MARU, SEMA, PADIPAHRIORPAHI, BHILI, ASSAMESE, BENGALISPOKEN, WASIVERIORVERON, GURUNG, SANGPANG, SEMANG, DIMASA, NEWARI, MISHMIDIGARU	79	U+00f5
_ᵃ	_ᵃ	ᵃ-ko ᵃ-wu kai  θein, wā ᵃlu	TAUNGTHA, PHUNSAMONG, ARAKANESE, MEGYAO, LAI, THAYETMYOCHIN, DANU, MAINGTHAORNGACHANG, HIROILAMGANG	79	U+005f U+1d43
θ$	θ	aleθ, p’iθ	MALTOORMALER, EASTERNBENGALI, TODA, SARIKOLI, SHIYNI, MUNJANIORMUNGI, ARABIC	75	U+03b8 U+0024
ns	ns	NOTE: The tone contours used by the author of the text are inconsistent and inaccurate, hansa	PADARI, SAVARA, NUNG, SHOORKHYANG, ORMURI, MIAOTSUHMONG, GONDI, BODOORBARA, KUIKANDHIORKHOND, GADABA, BURUSHASKI, ASSAMESE, NEWARI, ARABIC, RANGKAS, BALTI, JUANG, KHARIA, GURUNG, LIMBU, MIKIR, YAKHA, BASHGALI, MURMI, MIJU	74	U+006e U+0073
δ	δ	woδ δåyin, woδ-av δåd	SHIYNI, SARIKOLI, PAHLAVI, ARABIC, AVESTAN, EASTERNBENGALI, WAXI, BURMESESPOKEN, WEWAW, PERSIAN	74	U+03b4
iᵏ	iᵏ	ge  hwaiᵏ lǔ^ṟ^h, ge  hwaiᵏ guai	DANU, KATURR, TAVOYAN, BURMESESPOKEN, MARU, MUNDARI, LOHORONG, TALAINGSPOKEN	74	U+0069 U+1d4f
^P	<?>	Parmēsar, P’rā	CHIRU, KATHIYAWADI, PRAKRIT, SON, THADO, KHAMTI, TAUNGTHU, ZAVEIN, LUSHEI, KOLHRENG, AMOK, MANCHATIORPATNI, ORIYA, BHOJPURINORTHERN, MOENGLWE, SINHMAOMAEPAUK, AHOM, KADU, KANGRA, WAR, BANJOGI, RAMBANI, BIHARIMAITHILI, GARHWALI, ARAKANESE, MAGAHI, EASTERNHINDIAWADHI, PANGWALI, SINGPHO, PALAUNG, SANSKRIT, CHAM, CHINBON, KHUN, TORWALI, CHAMEALI, BHADRAWAHI, KULUI, RANGKAS, MALVI, AIMOL, PYENORPYIN, BUNDELI, HRANGKHOL, DANAO, SIRMAURI, BAGHATI, GONDI, CENTRALPAHARIKUMAUNI, KACHCHHI, BRAJBHAKHA, HLOTA, LU, WASIVERIORVERON, EN, JAIPURI, KHMER, MANDEALI, DODASIRAJI, GURUNG, KOM, KANAURI, TAILOI, ANGKU, HALLAM, BANAPHARI, BAGHELI, CHAROTARI, GADI, DOGRI	73	U+005e U+0050
ǎ$	ǎ	˨ chǎ, pǒtrǎ	GYPSYSYRIAN, GYPSYEUROPEAN, RAMBANI, LISU, LISHAOYAOYIN, SIAMESEWRITTEN, SIAMESESPOKEN, PEMIAO, KATURR, EN	72	U+01ce U+0024
āw	āw	tū̃ jāwē, ū jāwas	PASHAIWESTERN, RAJASTHANIMARWARI, KOCH, MALVI, BHOJPURINORTHERN, SINGHALESE, BHOJPURISOUTHERN, TABLENG, KATHIYAWADI, WESTERNPAHARIJAUNSARI, NIMADI, GARHWALI, ASSAMESE, PANJABIWRITTEN, GONDI, KASHMIRI, JAIPURI, HINDKI, BANGARU, GHISADI, LABHANIOFBERAR, POGULI, DUMI, HIROILAMGANG, EASTERNBENGALIOFCACHAR, SIRMAURI, PASHAIEASTERN, MEWATI, NICOBARESE, CHAROTARI	72	U+0101 U+0077
^å	ḁ	å-på, åkåe	PALAUNG, DHIMAL, KATURR, HAURPA, LAHU, TAKPA, SAKUPA, SALON, MANYAK, BANPARA, MANOE, KARENBYU, SON, ZAVEIN, SEMANG, KATHIYAWADI, KHERWARISANTHALI, SIYIN, PYENORPYIN, MUNDARI, AKO, LANGRONG, ISHKASHMIZEBAKI, AHI, GHEKO, PEMIAO	70	U+005e U+00e5
^ū̃	ũ̄	ū̃ṭ, ū̃chō	RAJASTHANIMARWARI, KANAUJI, MALVI, SIRMAURI, BHOJPURINORTHERN, GUJARATISTANDARD, DAKHINI, WESTERNHINDIHINDOSTANI, GARHWALI, MAGAHI, EASTERNHINDIAWADHI, CHHATTISGARHI, BUNDELI, BRAJBHAKHA, NAGPURIA, JAIPURI, EASTERNPAHARIORKHASKURA, HINDKI, BANGARU, BANAPHARI, BAGHELI, BHOJPURISOUTHERN, RAIORJIMDAR, VERNACULARHINDOSTANI, LARI, NIMADI, BIHARIMAITHILI, NAGPURI, POGULI, BHADRAWAHI, GUJURIOFHAZARA, CHIBHALI, BAGHATI, CENTRALPAHARIKUMAUNI, KIUTHALI, SHINAGILGITI, DODASIRAJI, MULTANI, KASHTAWARI, SHODOCHI, MEWATI, PADARI, DOGRI	69	U+005e U+016b U+0303
^ōh	ōh	ōh māran, ōh mārsī	POWADHI, PUNCHHI, TINAULI, CHIBHALI, GADI, BHADRAWAHI, CHAMEALI, PANJABISPOKEN, CHAMBALAHULI	69	U+005e U+014d U+0068
õ$	õ	sõ, nõ	ASSAMESE, SEMA, PADIPAHRIORPAHI, GURUNG, WASIVERIORVERON, KUIKANDHIORKHOND, MARU, KANASHI, PANJABISPOKEN, NEWARI, MAGAHI, PWOBASSEIN, PWOMAULMEIN, LOLONI, MOSHO, BASHGALI, MARATHIDESHI, BAGHELI, MIJU	68	U+00f5 U+0024
chʸ	chʲ	˨˦ chʸāy koṅ, ˨˦ chʸāu miēn ˨˦ chʸàṅ	MIAOTSUHMONG, MANTAPAN, MANLANTIEN	67	U+0063 U+0068 U+02b8
àh	àh	pà d^àhà̃, dö p’ä d^àhe	GHEKO, YEINBA, KARENNI, DHIMAL, MANCHU, MALAY, KOREAN, KATURR, ANDRO, SAKAI, YINTALAE, SENGMAI, TALAINGSPOKEN, ARABIC, SALON	66	U+00e0 U+0068
à̃$	ã̀	pà d^àhà̃, säᵘ nà̃	YEINBA, PWOMAULMEIN, PWOBASSEIN, AKAKA, CENTRALPAHARIKUMAUNI, GHEKO, KARENNI, CHINGPAORKACHIN, LAHU	66	U+00e0 U+0303 U+0024
c	c	NOTE: The tone contours used by the author of the text are inconsistent and inaccurate, māi bår. In most dialects the attributive adjective follows	PADARI, SAKAI, SANSKRIT, KHAMTI, KANASHI, KABUI	65	U+0063
àw	àw	^àwe le yoᵖ, ^àwe tà̃	PADAUNG, PWOMAULMEIN, GHEKO, SGASPOKEN, PWOBASSEIN, MANOE, CENTRALPAHARIKUMAUNI, CHAIREL, MALAY	65	U+00e0 U+0077
mw	mw	^amwi, ˦ mwa ˦ lü	CHINBON, PWOLITERARY, PEMIAO, MIAOTSUHMONG, ARAKANESE, DANU, SON, TALAINGWRITTEN, TAILOI, INTHA, PADAUNG, LAI, TAVOYAN, TAUNGYO, HLOTA, EN, GHEKO, YAWDWIN	65	U+006d U+0077
mᵃ	mᵃ	sāmᵃnē, hamᵃnī marᵃlī̃	SIRIPURIA, THAYETMYOCHIN, MAGAHI, BHOJPURISOUTHERN, BHOJPURINORTHERN, NAGPURIA, BIHARIMAITHILI, BUNDELI, BANGARU, KATHIYAWADI, PADARI, CHAROTARI	65	U+006d U+1d43
às	às	nå wàde tàså, ^àsau	KARENBYU, WEWAW, CHAM, PWOMAULMEIN, SHINAGILGITI, MANCHU, PWOBASSEIN, GYAORUNG, SGASPOKEN, TALAINGSPOKEN, SAKAI, KOREAN, SEMANG, KADU, WAR, MOPWABILICHI, MOPWADERMUHA, HAURPA, PYENORPYIN, KARENNI, AKO, GHEKO, NUNG, LISHAOYAOYIN	64	U+00e0 U+0073
ẕ	<?>	ḏẕǒt’, māḏẕ’ā	PASHTOOFKANDAHAR, KULUI, MARU, KONKANI, SHODOCHI, MANCHATIORPATNI, NAGPURI, CHAROTARI, MARATHIDESHI, ORMURI, SARIKOLI, ANGAMI, SHIYNI, LADAKHI, PADAUNG, PADARI, MANTAPAN, BHOTIATIBETANWRITTEN, MOPWABILICHI, YACHUMI, PANGWALI, YEINBA, BHOTIATIBETANSPOKEN, BALTI, RENGMA, BWE, LADAKHIOFSPITI, SHARPA, WAZIRI	64	U+1e95
ṣ	ṣ	pakṣī, manuṣya	SANSKRIT, BENGALIWRITTEN, MALAYALAM, MARATHIDESHI, KANARESE, ORIYA, KHANDESI, SINGHALESE, KANAURI, GUJARATISTANDARD, KANASHI, BIHARIMAITHILI, GARHWALI, NAGPURI, PASHTOOFKANDAHAR	62	U+1e63
ï	ï	b’aïn, gaïyā̃	BHOJPURINORTHERN, GAWARBATI, BHOJPURISOUTHERN, MAGAHI, BUNDELI, KACHCHHI, KHANDESI, CHAROTARI, BENGALIWRITTEN, KANAUJI, PRAKRIT, BANAPHARI, KONKANI, MANCHATIORPATNI, BURMESESPOKEN, SOUTHWESTERNBENGALI, EASTERNBENGALIOFCHITTAGONG, GYAOMI, KAIKADI, CHHATTISGARHI, EASTERNBENGALIOFCACHAR, EASTERNBENGALI, LANTENYAO, KHARAWA, BHOTIAOFPURIK, PADARI	62	U+00ef
ḥ	ḥ	māḥ  me, P’ūrāḥ tāḥ-rāḥ	TALAINGWRITTEN, AHOM, ARABIC, SHINAGILGITI, KHMER, THALI, SANSKRIT, CHAM, KULUI, CHILASI	61	U+1e25
ä̃	ã̈	mä̃ mārā̃, mä̃ māreā	KHERWARISANTHALI, DHANNI, POTHWARI, MULTANI, CHIBHALI, THALI, LAHNDAOFSHAHPUR, MUNDARI, TINAULIOFSALTRANGE, LADAKHIOFSPITI	61	U+00e4 U+0303
īs$	īs	bīs, vīs	NIMADI, SHIYNI, KOHISTANIGARWI, GARHWALI, KHANDESI, BALTI, PASHAIEASTERN, BHOTIAOFPURIK, SAKAI, BHOJPURINORTHERN, GUJARATISTANDARD, VERNACULARHINDOSTANI, KONKANI, DAKHINI, BIHARIMAITHILI, WESTERNHINDIHINDOSTANI, LABHANIOFBERAR, NAGPURI, MAGAHI, RAJASTHANIMARWARI, KANAUJI, EASTERNHINDIAWADHI, RANGKAS, MALVI, CHHATTISGARHI, LADAKHI, BUNDELI, SUNWAR, GYPSYSYRIAN, GONDI, THAMI, SIRIPURIA, KHARAWA, CENTRALPAHARIKUMAUNI, BRAJBHAKHA, BALOCHIMAKRANI, MAGARI, NAGPURIA, JAIPURI, EASTERNPAHARIORKHASKURA, SHINAGILGITI, DODASIRAJI, BANGARU, MEWATI, PASHAIWESTERN, BANAPHARI, MARATHIDESHI, BAGHELI, BHOJPURISOUTHERN	59	U+012b U+0073 U+0024
w$	w	naw, raw-	KHASISTANDARD, TALAINGWRITTEN, CHHATTISGARHI, WAR, KHANDESI, PERSIAN, BHOJPURINORTHERN, INTHA, NIMADI, RAJASTHANIMARWARI, KANAUJI, EASTERNHINDIAWADHI, SARIKOLI, GUJARATISTANDARD, KATHIYAWADI, DAKHINI, WESTERNPAHARIJAUNSARI, SINGHALESE, LABHANIOFBERAR, PAHLAVI, MALVI, EASTERNBENGALI, KHARAWA, BALOCHIMAKRANI, ISHKASHMIZEBAKI, BHILI, NAGPURIA, WAXI	58	U+0077 U+0024
tᵃ	tᵃ	kutᵃrō, kutᵃrī	TAUNGTHA, KATHIYAWADI, GUJARATISTANDARD, GHISADI, BHILI, CHAROTARI, MALVI, DANU, VERNACULARHINDOSTANI, MALAYALAM, MAGAHI, KONKANI, BWE, NIMADI, MARATHIDESHI, KASHMIRI, WEWAW	58	U+0074 U+1d43
gg	gg	aggē, aggiā̃	HINDKI, LARI, HAURPA, PANJABISPOKEN, TELUGU, PANJABIWRITTEN, PRAKRIT, POGULI, HLOKE, TULU, GONDI, SINDHIVICHOLI, MANDEALI, THALI, CHAMEALI, KANGRA, TINAULIOFSALTRANGE, DARANG, KOTA, DHANNI, TINAULI, BHADRAWAHI, GUJURIOFHAZARA, KULUI, POWADHI, MULTANI, PUNCHHI, KURUXORORAO, BADAGA, TODA, LAHNDAOFSHAHPUR, DOGRI	57	U+0067 U+0067
ẽ$	ẽ	hẽ, yẽ	KONKANI, TAUNGTHA, WAIALA, NEWARI, NICOBARESE, BASHGALI, PANJABISPOKEN, SEMANG, WASIVERIORVERON, NAGPURIA, HLOTA, TAUNGYO, LARI, PADIPAHRIORPAHI, EASTERNBENGALI, PADAUNG, KHANDESI, MAN, KURKU, SINDHIVICHOLI, LAI, MURMI	55	U+1ebd U+0024
^˧˨	³²	˧˨ ñi, ˧˨ ṅa	AHI, LOLOPHO, LOLONI, SIAMESEWRITTEN, SIAMESESPOKEN, SHAN, SGALITERARY, MANDARIN	54	U+005e U+02e7 U+02e8
rr$	rr	sa-korr, t’irr	YACHUMI, KOLHRENG, HIROILAMGANG, THUKUMI, CHIRU, MOSHANG, ANGAMI, HLOTA, CHINBOK, PURUM, BRAHUI, PHADANG, PANGWALI, ARABIC, PAHLAVI, AIMOL, GONDI, CHILASIOFDAHHANU, RENGMA, BODOORBARA, TAILOI, KEZAMA	54	U+0072 U+0072 U+0024
ã$	ã	hã, hrã	RANGKAS, NEWARI, BASHGALI, MARU, BIHARIMAITHILI, PRAKRIT, WAIALA, ORIYA, MANCHATIORPATNI, CHAMBALAHULI, EASTERNPAHARIORKHASKURA, BHOJPURINORTHERN, MIJU, KATHIYAWADI, KHALING, SOUTHWESTERNBENGALI, WAZIRI, KOCH, PADIPAHRIORPAHI, EASTERNBENGALI, GAWARBATI, BALOCHIMAKRANI, HLOTA, KHARIA, KURUXORORAO, LADAKHIOFSPITI	54	U+00e3 U+0024
^ās	ās	āsī, āsta	KURUXORORAO, PRAKRIT, SANSKRIT, CHILASI, EASTERNBENGALI, AO, PASHTOOFPESHAWAR, SEMANG, AVESTAN, KUIKANDHIORKHOND, AKA, BAHING, PASHTOOFKANDAHAR, ABOR, MIRI, PAHLAVI, CHAKMA, BALOCHIMAKRANI, KASHTAWARI, TURKI, GAROACHIK, PADARI	53	U+005e U+0101 U+0073
^ī$	ī	ī, ī-	KATHIYAWADI, SINGPHO, ANDRO, PASHAIEASTERN, TURKI, NAMSANGIA, PASHAIWESTERN, KALASHA, THADO, TAKPA, SARIKOLI, BAHING, KHALING, KHANGOI, BURUSHASKI, GYAOMI, SEMA, BRAHUI, PHADANG, PANGWALI, RODONGORCHAMLING, KWOIRENG, MAINGTHAORNGACHANG, ARABIC, TULU, SZIORATSI, CHAMBALAHULI, SHIYNI, LANTENYAO, THULUNG, KHARAWA, KHOWARORCHITRALI, ISHKASHMIZEBAKI, WASIVERIORVERON, BHILI, AO, DODASIRAJI, MOSHANG, SHODOCHI, DUNGMALI, WAIALA, MIKIR, WAXI, PURUM, SENGMAI, PERSIAN	53	U+005e U+012b U+0024
nn$	nn	kann, chann	CHANG, THALI, POTHWARI, PANJABIWRITTEN, TINAULIOFSALTRANGE, PANJABISPOKEN, POGULI, DHANNI, TINAULI, GUJURIOFHAZARA, CHIBHALI, POWADHI, DODASIRAJI, KASHTAWARI, PUNCHHI, PADARI, LAHNDAOFSHAHPUR, DOGRI, CHAMEALI, KANGRA, KORAVA, RAMBANI, PANGWALI, ARABIC, BHADRAWAHI, KULUI, GADI, BRAJBHAKHA, MULTANI, KURUXORORAO	53	U+006e U+006e U+0024
nᵘ$	nᵘ	hunnᵘ, hūnᵘ	MALAYALAM, KANARESE, TELUGU, KASHTAWARI, SINDHIVICHOLI, KASHMIRI, POGULI, PADARI	53	U+006e U+1d58 U+0024
ēw	ēw	sē ḍēwā, ch’ēwṛī	KIUTHALI, SIRMAURI, SHODOCHI, TINAULIOFSALTRANGE, POTHWARI, LAHNDAOFSHAHPUR, WAR, KANAUJI, CHIBHALI, THALI, PAHLAVI, SINGHALESE, NIMADI, LABHANIOFBERAR	52	U+0113 U+0077
ōs	ōs	hōsai, lōsēi ā-tum	WAZIRI, MIKIR, WAIALA, PASHTOOFKANDAHAR, KHOWARORCHITRALI, SHINAGILGITI, CHILASIOFDRAS, POGULI, CHILASIOFDAHHANU, KANAURI, KUIKANDHIORKHOND, PANGWALI, PRAKRIT, GYPSYSYRIAN, KASHMIRI, HLOTA, CHANG, KASHTAWARI, CHAURASYA, JAPANESE, SINDHIVICHOLI	52	U+014d U+0073
rs	rs	NOTE: The tone contours used by the author of the text are inconsistent and inaccurate, ōh mārsī	PADARI, EASTERNBENGALIOFCACHAR, TINAULI, CHIBHALI, PUNCHHI, MANDEALI, THALI, CHAMEALI, GADI, BASQUE, LAHNDAOFSHAHPUR	51	U+0072 U+0073
ě$	ě	tě, šě	KASHMIRI, PADARI, KASHTAWARI, BENGALISPOKEN, RAMBANI, KHOWARORCHITRALI, KULUI, EASTERNBENGALIOFCACHAR, EASTERNBENGALI, POGULI, KATURR, MANDEALI, INTHA, TINAULI, WASIVERIORVERON, GUJURIOFHAZARA, DODASIRAJI	51	U+011b U+0024
